Factory Name;Factory Type;Product Type Type;Nike, Inc. Brand(s);Events;Supplier Group;Address;City;State;Postal Code;Country / Region;Region;Total Workers;Line Workers;% Female Workers;% Migrant Workers
Fashion Garments 2 Co., Ltd - Xuan Tay;FINISHED GOODS;Apparel;Nike;;HIRDARAMANI;Hamlet 1, Xuan Tay Commune, Cam My District, Dong Nai Pro;Cam My District;Ðng Nai;810000;Vietnam;SE ASIA;686;598;89;0
FASHION GARMENTS MEKONG CO., LTD;FINISHED GOODS;Apparel;Nike;;FASHION GARMENTS;818B Highway 30 Hamlet 3 An Hoa Commune;Tam Nong ;Ðng Tháp;870000;Vietnam;SE ASIA;1852;1702;66;0
Feng Tay Enterprises Co., Ltd;FINISHED GOODS;Footwear;Nike;;FENG TAY;No 52 Kegong 8th Road;Douliou;Yunlin;640;Taiwan;N ASIA;1828;282;50;0
FITA TEKSTIL KONF.LTD.STI;FINISHED GOODS;Apparel;Nike;;YESIM;PANAYIR MAH  6 SELVILI SK;Bursa;Bursa;16100;Turkey;EMEA;420;380;88;0
Fjord, Ltd.;FINISHED GOODS;Apparel;Nike;;TEGRA;3099 N Pacific Highway Suite 100;Woodburn;Oregon;97071;USA;AMERICAS;106;94;95;0
FOOTMARK CAMBODIA CORPORATION;FINISHED GOODS;Apparel;Nike;;FOOTMARK;Sangkat Kantouk  Khan Posencey;Phnom Penh;Kandaal;12101;Cambodia;SE ASIA;144;135;84;0
FORMOSA TAFFETA (CHANGSHU) CO., LTD;MATERIALS;Apparel;Nike;;FORMOSA TAFFETA;No.15 Peng-Hu RD.;Changshu;Jiangsu;215500;China;N ASIA;260;138;28;0
FORMOSA TAFFETA CO., LTD.;MATERIALS;Apparel;Nike;;FORMOSA TAFFETA;317 Shuliou Road;Touliou;Yunlin;640;Taiwan;N ASIA;1868;1442;38;37
FORMOSA TAFFETA DONG NAI CO., LTD.;MATERIALS;Apparel;Nike;;FORMOSA TAFFETA;Nhon Trach 3 Ind Zone Hiep Phuoc Town;Nhon Trach District;Ðng Nai;71000;Vietnam;SE ASIA;1116;974;53;6
FORMOSA TAFFETA VIETNAM CO LTD;MATERIALS;Apparel;Nike;;FORMOSA TAFFETA;Section 1 Nhut Chanh Com Ben Luc District;Ben Luc District;Long An;81000;Vietnam;SE ASIA;1061;920;48;3
FORMOSA TING SHO ENT CO LTD (TAIWAN);MATERIALS;Footwear;Nike;;FORMOSA TING SHO;NO 37 SEC 2 ZHONGSHAN RD DACUN;Changhua;Changhua;515;Taiwan;N ASIA;90;28;65;43
framas Korea;FINISHED GOODS - COMPONENTS;Footwear;Nike;;FRAMAS;1426 Nakdong Street;Busan;Busan Gwangyeogsi;46904;South Korea;N ASIA;45;19;10;0
framas Korea Vina Co., Ltd;FINISHED GOODS - COMPONENTS;Footwear;Nike;;FRAMAS;Workshop 1 to 5 Longthanh IP Longthanh District;Dong Nai;Ðng Nai;815300;Vietnam;SE ASIA;782;479;41;0
FREETREND INDUSTRIAL (VIETNAM) CO., LTD;FINISHED GOODS;Footwear;Nike;Collegiate;DEAN SHOES;Saigon Linh Trung;Thu Duc;Ho Chi Minh;71308;Vietnam;SE ASIA;13546;12490;85;0
Fu-Luh Shoes Co., LTD;FINISHED GOODS;Footwear;Nike;;CHING LUH;Tri Yen Hamlet Tan Kim Commune Can Giuoc County;Long An;Long An;82500;Vietnam;SE ASIA;11427;10161;76;0
Fujian Lifeng Footwear Industrial Development CO.,LTD.;FINISHED GOODS;Footwear;Nike;;FENG TAY;Wutang Town Hanjiang District Putian City Fujian Province ;Putian;Fujian;351119;China;N ASIA;3837;3190;75;0
Fujian San Feng Footwear Co.,Ltd;FINISHED GOODS;Footwear;Nike;;FENG TAY;No. 399, ChengMen Street, ChengMen Town, CangShan Districts;Fuzhou;Fujian;350018;China;N ASIA;3453;2819;84;0
Fujian Xiefeng Footwear Co.,Ltd.;FINISHED GOODS;Footwear;Nike;;FENG TAY;Xi Tian Wei Town,Licheng Distric;Putian;Fujian;351131;China;N ASIA;4961;4081;76;0
Future Garment Co., Ltd.;FINISHED GOODS;Apparel;Nike;;HI TECH;211 18 26;Bangkok;Bangkok;10120;Thailand;SE ASIA;434;358;66;91
Gain Lucky (Vietnam) Limited;MATERIALS;Apparel;Nike;Collegiate;SHENZHOU;NO 40 6 N14 Street;Phuoc Dong Ward;Tây Ninh;80700;Vietnam;SE ASIA;9032;8781;46;0
GB LIGHT CO LTD;MATERIALS;Footwear;Nike;;GB LIGHT;22 Beombang 3ro 30beon gil;Gangseo Gu;Busan Gwangyeogsi;46727;South Korea;N ASIA;109;38;0;0
GB LIGHT CO LTD (VIETNAM);MATERIALS;Footwear;Nike;;GB LIGHT;LOT B2 7;Thu Dau Mot;Bình Duong;75000;Vietnam;SE ASIA;39;24;0;13
Germton Industrial Company Ltd.;FINISHED GOODS;Apparel;Nike;;GERMTON;Dong Que Son IP Huong An  Que Son  Quang Nam Province;Huong An Town;Qung Nam;560000;Vietnam;SE ASIA;2236;1852;89;0
Gianel Shoes srl;FINISHED GOODS;Footwear;Nike;;GIANEL;ZONA INDUSTRIALE;CASARANO;Lecce;73042;Italy;EMEA;157;152;92;4
GILDAN ACTIVEWEAR (HONTEX RN1);MATERIALS;Apparel;Nike;;GILDAN;Zip San Miguel Vl Rio Nance Choloma Honduras;Choloma;Cortés;504;Honduras;AMERICAS;2;1;1;100
GILDAN HOSIERY RIO NANCE S de R.L.;FINISHED GOODS;Equipment;Nike;;GILDAN;Zip San Miguel VI Rio Nance Km 15 and 5;Choloma;Yoro;0;Honduras;AMERICAS;1738;1737;21;0
Global Sales and Warehousing, LLC;FINISHED GOODS;Equipment;Nike;;GLOBAL SALES WAREHOUSING;1500 E 3rd St;Oxnard;California;93030;USA;AMERICAS;38;27;33;0
GOLD LONG JOHN (INDONESIA);MATERIALS;Footwear;Nike;;GOLD LONG JOHN;Jl Raya Batujajar KM 3 5 desa giriasih;Kecamatan Batujajar;Jawa Barat;40561;Indonesia;S ASIA;297;184;10;3
GOLD LONG JOHN (TR1) (CHINA);MATERIALS;Footwear;Nike;;GOLD LONG JOHN;NO 95 GAO PING INDUSTRIAL ZONE SAN JIAO TOWN;Zhongshan Guangdong;Guangdong;528445;China;N ASIA;242;137;55;0
GOLD LONG JOHN (TR1) (TAIWAN);MATERIALS;Footwear;Nike;;GOLD LONG JOHN;NO350  Fuxing Rd  Beidou Township;Changhua;Changhua;52147 / 51341;Taiwan;N ASIA;580;232;40;13
Gold Long John (Vietnam 2nd location);MATERIALS;Footwear;Nike;;GOLD LONG JOHN;Road 25B Nhon Trach 2 Industrial Zone;Nhon Trach;Da Nang-- thanh ph;815956;Vietnam;SE ASIA;580;476;67;3
GOLD LONG JOHN (VIETNAM);MATERIALS;Footwear;Nike;;GOLD LONG JOHN;LOT NO 7 ROAD 5A  NHON TRACH 2 INDUSTRIAL ZONE;Dong Nai;Ðng Nai;815956;Vietnam;SE ASIA;443;309;33;3
Green TG Co., Ltd;FINISHED GOODS;Apparel;Nike;;SNOGEN GREEN;Lot AIII-11, Tan Huong Industrial Park , Tan Huong Ward,;Tien Giang;Tin Giang;82000;Vietnam;SE ASIA;691;598;83;0
GREEN VINA CO., LTD.;FINISHED GOODS;Apparel;Nike;Collegiate;SNOGEN GREEN;BINH DANG QUARTER BINH HOA WARD;THUAN AN;Bình Duong;590000;Vietnam;SE ASIA;572;536;81;0
Greentech Headgear Company Limited ;FINISHED GOODS;Apparel;Nike;Collegiate;ASIAN SOURCING HEADWEAR;D02 Street Chau Duc Industrial Zone;CHAU DUC;Bà Ra - Vung Tàu;78000;Vietnam;SE ASIA;2050;1436;58;0
Guangdong Glory textile Enterprise Co., Ltd.;MATERIALS;Footwear;Converse;;HARVEST GLORY;Heping Xiacuo Industrial Park;Shantou;Guangdong;515154;China;N ASIA;204;143;49;0
Guangdong Zhongyun Intelligent Manufacturing Garment Co., Ltd;FINISHED GOODS;Apparel;Nike;;GZY;One of three buildings No11 Guangchen Road Jixi Xiaolan Town;ZHONGSHAN CITY;Guangdong;528415;China;N ASIA;61;40;60;0
Guangzhou Yisetong Clothing Co.Ltd;FINISHED GOODS;Apparel;Nike;;GUANGZHOU YISETONG;Jinshan Industrial Park 8 building 4F;Guangzhou;Guangdong;511400;China;N ASIA;5;4;3;0
GUSHI BRANCH YANGZHOU BAOYI SHOES;FINISHED GOODS;Footwear;Converse;;LAI YIH;Southeast corner intersection;Xinyang;Hunan;465200;China;N ASIA;236;213;99;0
H&L APPAREL(VIETNAM) CO.,LTD;FINISHED GOODS;Apparel;Nike;;H&L;Lot D 11 CN My Phuoc 2 IP My Phuoc Ward;Ben Cat District;Bình Duong;590000;Vietnam;SE ASIA;850;800;80;0
Ha Noi Garment No. 40 Joint Stock Company;FINISHED GOODS;Apparel;Nike;;MAXPORT;88 Ha Dinh Thanh Xuan Dist;Ha Noi City;Ha Noi;800000;Vietnam;SE ASIA;302;72;80;0
Haian Textile Printing & Dyeing (Fuqing) Co.,Ltd.;MATERIALS;Footwear;Converse;;HAIAN;Jiangyin Industrial Zone;Fuqing;Fujian;350313;China;N ASIA;43;33;26;0
Haivina Hong Linh Co. Ltd;FINISHED GOODS;Equipment;Nike;;HAIVINA HONG;Nam Hong Industrial Zone;Ha Tinh Province;Hà Tinh;480000;Vietnam;SE ASIA;1283;1154;98;0
Haiyan Golden Gate Socks Industry Co., Ltd;FINISHED GOODS;Equipment;Nike;;HAIYAN;No 15 Zhangqiao Village;Haiyan;Zhejiang;314300;China;N ASIA;65;44;52;0
HAYAFUJI;FINISHED GOODS;Footwear;Nike;;HAYAFUJI;96-9, Haradaniinui-cho, Ookitayama;Kyoto-shi;Kyoto;603-8487;Japan;N ASIA;5;4;50;0
HAYLEYS FABRIC PLC ;MATERIALS;Apparel;Nike;;MAS HOLDINGS;Nartupana Estate;Neboda;Kalutara;12030;Sri Lanka;S ASIA;1667;1236;12;0
HESHAN TOP EAGLE GARMENT LTD.;FINISHED GOODS;Apparel;Nike;;NICE APPAREL;NO 001 DISTRICT 3 OF HECHENG INDUSTRIAL PARK;Heshan;Guangdong;529727;China;N ASIA;701;375;95;0
HESHENG CO., LTD.;FINISHED GOODS;Equipment;Nike;Collegiate;HESHENG;Lot G14 Que Vo Industrial Park expansion;Bac Ninh;Bc Ninh;16852;Vietnam;SE ASIA;64;59;55;3
Hi-Tech Apparel Cambodia Co., Ltd.;FINISHED GOODS;Apparel;Nike;Collegiate;HI TECH;A35 36 Poipet ONeang Special EcoZone;Poipet;Banteay Mean Chey;10902;Cambodia;SE ASIA;3300;2627;68;1
HI TECH APPAREL CO LTD, BRANCH 70;FINISHED GOODS;Apparel;Nike;Collegiate;HI TECH;5 18 Soi suksawat;Bangkru;Samut Prakan;10130;Thailand;SE ASIA;1135;912;60;85
Hi-Tech Apparel Co. Ltd.;FINISHED GOODS;Apparel;Nike;Collegiate;HI TECH;328 Prachauthit Rd  Thoongkru;Bangkok;Bangkok;10140;Thailand;SE ASIA;1264;781;75;42
HI-TECH APPAREL CO.,LTD. (SUPANBURI BRANCH);FINISHED GOODS;Apparel;Nike;Collegiate;HI TECH;295 MOO 1 TAMBOL DONKAMYAN;Suphanburi;Suphan Buri;72000;Thailand;SE ASIA;365;320;77;13
Hi-Tech Chaiyaphum Apparel (2020) Co.,Ltd.;FINISHED GOODS;Apparel;Nike;;HI TECH;9 Moo 11 Tambol Naseiw;Muang;Chaiyaphum;36000;Thailand;SE ASIA;842;740;57;37
Hi-Tech Chaiyaphum Apparel (2011) Co.,Ltd.;FINISHED GOODS;Apparel;Nike;Collegiate;HI TECH;999 Moo 3  Tumbol Ladyai   Amphur Muang;Muang;Chaiyaphum;36000;Thailand;SE ASIA;1052;922;59;20
Hi-Tech Surin Apparel co., ltd. (Branch 1);FINISHED GOODS;Apparel;Nike;Collegiate;HI TECH;489 Moo 7;Thatoom;Surin;32120;Thailand;SE ASIA;696;656;66;4
Hi-Tech Viet Nam Apparel Co.,Ltd.;FINISHED GOODS;Apparel;Nike;Collegiate;HI TECH;Block A3.2, Tay An Industrial Zone, Duy Trung Commune;Duy Xuyen District;Qung Nam;560000;Vietnam;SE ASIA;1787;1771;84;0
Higuchi Kaban Kobo ;FINISHED GOODS;Equipment;Nike;;CROSTER;2-4-18 Motogo;Saitama;Saitama;332-0011;Japan;N ASIA;19;15;50;13
Hip Keung (Cambodia) Manufacturing Co., Ltd.;FINISHED GOODS;Apparel;Nike;;HIP KEUNG;Preah Khe Village Kahang Commune;Phnom Penh;Kampong Spueu;50802;Cambodia;SE ASIA;723;694;80;1
HONG SHENG LEATHER DONGGUAN IND. CO., LTD;FINISHED GOODS;Equipment;Nike;Collegiate;GUANG DER;No25;Dong Guan;Guangdong;523121;China;N ASIA;1219;863;66;0
HONSIN APPAREL SDN. BHD.;FINISHED GOODS;Apparel;Nike;;HONSIN;531 BATU 2 1 2;BATU PAHAT;Johor;83000;Malaysia;S ASIA;957;878;24;83
Honways Apparel Shuyang Limited;FINISHED GOODS;Apparel;Nike;;HONSIN;No 6 Jiaxing Road East Shuyang Economic Dev Zone;Jiangsu Province;Jiangsu;223600;China;N ASIA;479;342;89;0
Hoosier Manufacturing, Compania Limitada;FINISHED GOODS;Apparel;Nike;;INDIANA KNITWEAR;18 Avenida 37-39 Zona 12;Guatemala;Guatemala;1000;Guatemala;AMERICAS;424;401;57;0
HUA FENG (CHINA);MATERIALS;Footwear;Nike;;HUA FENG TEXTILE;West side;Putian;Fujian;351146;China;N ASIA;280;231;34;0
Hua Feng Haptic Vietnam;MATERIALS;Footwear;Nike;;HUA FENG TEXTILE;4th floor of Textile Building;Nhon Trach;Ðng Nai;76000;Vietnam;SE ASIA;90;81;50;6
HUAFENG HAPTIC;FINISHED GOODS - COMPONENTS;Footwear;Nike;;HUA FENG TEXTILE;GF Building D10, Hua Feng Sporting Goods Industrial Park;Putian;Fujian;351144;China;N ASIA;92;75;64;0
Huaian Yuangtong Headwear Mfg Co Ltd;FINISHED GOODS;Apparel;Nike;Collegiate;ASIAN SOURCING HEADWEAR;NO 30 YAN HUANG AVENUE;HUAI AN;Jiangsu;223400;China;N ASIA;702;567;82;0
Huajin Textile Printing &Dyeing Co.,LTD;MATERIALS;Footwear;Converse;;HUAJIN;No 1688 Huajin Street;Linyi County;Shanxi;44100;China;N ASIA;878;689;55;14
Hubei Sunsmile Footwear Co., Ltd.;FINISHED GOODS;Footwear;Converse;;FJ GROUP;NO 6 SHEN ZHEN INDUSTRIAL ZONE XIANG YANG CITY HUBEI CHINA;Xiang Yang;Hubei;441000;China;N ASIA;964;843;87;0
HUBEI TOP EAGLE GARMENT LTD.;FINISHED GOODS;Apparel;Nike;Collegiate;NICE APPAREL;EAST INDUSTRIAL PARK ECONOMIC DVELOPMENT ZONE;Songzi Hubei;Hubei;434200;China;N ASIA;343;278;93;0
HUIZHOU YANGMING INDUSTRIAL CO., LTD.;FINISHED GOODS;Equipment;Converse;;HYI;1 Xiaozhongtang 1st Road;HuiZhou;Guangdong;516001;China;N ASIA;60;40;66;0
HUNG LONG GARMENT AND SERVICE JOINT STOCK COMPANY;FINISHED GOODS;Apparel;Nike;;HUNG LONG GARMENT;NGUYEN VAN LINH STREET;MY HAO;Hung Yên;17000;Vietnam;SE ASIA;2300;2000;70;0
IMPULSE FASHION TAE HEE JOINT STOCK COMPANY;FINISHED GOODS;Apparel;Nike;;IMPULSE FASHION COMPANY;Phu Bai Industrial Zone;HUE;Tha Thiên-Hu;49000;Vietnam;SE ASIA;648;555;70;0
INDUSTRIAS MERLET, S.A. DE C.V.;FINISHED GOODS;Apparel;Nike;;INDUSTRIAS MERLET;Calle Circunvalacion No 3 Poligono A;Antiguo Cuscatlan ;La Libertad;0;El Salvador;AMERICAS;1068;949;60;0
INJEXTECH INC.;FINISHED GOODS;Equipment;Nike;;TAROKO INTERNATIONAL;No 407 Ben Tien Road Sec 2 An Nan District;Tainan;Tainan;709035;Taiwan;N ASIA;140;120;48;26
Interloop Limited;FINISHED GOODS;Apparel;Nike;;INTERLOOP;7 km Khurrianwala Jaranwala Road;Faisalabad;Punjab;37660;Pakistan;S ASIA;8771;6527;10;0
Iruna Comunicacion Textil - SERISUR;FINISHED GOODS;Apparel;Nike;;IRUNA;Poligono Industrial La Rosa V;Chauchina-Granada;Andalucía;18330;Spain;EMEA;16;13;50;0
ISA INDUSTRIAL CO LTD (HESHAN) (CHINA);MATERIALS;Footwear;Nike;;ISA;No  1 Xingli Road Hecheng Town;Heshan;Guangdong;529727;China;N ASIA;538;448;45;3
ISA INDUSTRIAL CO LTD (VIETNAM);MATERIALS;Footwear;Nike;;ISA;LOT M2 M3 VIET HUONG 2 INDUSTRIAL ZONE AN TAY VILLAGE;Binh Duong;Bình Duong;75000;Vietnam;SE ASIA;610;560;48;4
Jade Apparel Industries;FINISHED GOODS;Apparel;Nike;;YESIM;3RD INDUSTRIAL ZONE;ALEXANDRIA;AI Iskandariyah;21533;Egypt;EMEA;885;614;34;2
Jade Apparel Industries SAE;FINISHED GOODS;Apparel;Nike;;YESIM;New Borg El Arab city;Alexandria;AI Iskandariyah;21934;Egypt;EMEA;1142;587;20;4
Jade Textile Egypt;FINISHED GOODS;Apparel;Nike;;YESIM;A 6 Zone 103 and 104;10th of Ramadan City;Ash Sharqiyah;12451;Egypt;EMEA;3504;2645;29;12
Jade textile Ismailia S.A.E;FINISHED GOODS;Apparel;Nike;;YESIM;200 acres El Mostakbel Are Ismailia public Free Zone;Ismailia;AI Isma iliyah;41622;Egypt;EMEA;3149;1975;34;3
Jiangsu Asian Sourcing Headwear MFG. CO., Ltd;FINISHED GOODS;Apparel;Nike;Collegiate;ASIAN SOURCING HEADWEAR;No  2 South Guangzhou Road;Huai An;Jiangsu;223005;China;N ASIA;1170;929;86;0
JiangSu HongBao Sporting Goods Co., Ltd.;FINISHED GOODS;Equipment;Nike;;YEGIN;No 3 Building ShangShui Industry;HuaiAn;Jiangsu;223400;China;N ASIA;278;239;86;0
JIANGSU JINHUBAO GARMENT CO., LTD;FINISHED GOODS;Apparel;Converse;;DECOR;LIDIAN TOWN GUANGLING DISTRICT;YANGZHOU;Jiangsu;225106;China;N ASIA;141;122;85;0
Jiangxi Guangyou Shoetown Footwear Co., Ltd.;FINISHED GOODS;Footwear;Nike;Collegiate;SHOETOWN;Xiangtang village, Xiangtang town;Nanchang;Jiangxi;330201;China;N ASIA;1541;1196;84;0
JIAXING KANAAN BAG R&D CO.,LTD;FINISHED GOODS;Equipment;Nike;;KANAAN;Industrial Zone Qixing Town Nanhu District;Jiaxiang;Zhejiang;314002;China;N ASIA;127;30;80;0
JIAXING QUANG VIET GARMENT CO., LTD.;FINISHED GOODS;Apparel;Nike;;QUANG VIET;Pingxingxian Tongxinduan 318 Xindai Town;Ping Hu;Zhejiang;314211;China;N ASIA;1401;1272;62;0
JK GARMENTS PVT LTD;FINISHED GOODS;Apparel;Nike;;HONSIN;MADAGALLA ROAD IBBAGAMUWA;KURUNEGALA;Kurunegala;60500;Sri Lanka;S ASIA;1018;767;86;0
JOONGANG DYEING FABRIC CO., LTD;MATERIALS;Footwear;Nike;;JOONGANG TEXTILE;17 Hasinbeonyeong ro;Busan;Busan Gwangyeogsi;49432;South Korea;N ASIA;22;17;12;29
JOONGANG TEXTILE CO LTD (WARP/WEFT KNIT);MATERIALS;Footwear;Nike;;JOONGANG TEXTILE;15 Dadae ro 320beon gil;Busan;Busan Gwangyeogsi;49469;South Korea;N ASIA;75;28;43;4
JOV GARMENT ACCESSORIAL MATERIAL CO., LTD;MATERIALS;Apparel;Nike;;JOV GARMENT ACCESSORIAL MATERIAL;No 226 Pengfeng Road Dakun Industrial Zone;Songjiang;Shanghai;201600;China;N ASIA;117;66;46;0
K-L MFG. CO., INC.;FINISHED GOODS;Apparel;Nike;;K&L MANUFACTURING;2438 North Ruby Street;Spokane;Washington;99207;USA;AMERICAS;98;94;61;0
Kartli Textile Ltd;FINISHED GOODS;Apparel;Nike;;MILTEKS;20 Gagarini street;Rustavi;Tbilisi;3700;Georgia;EMEA;1278;1183;97;0
Kim's Embroidery, Inc.;FINISHED GOODS;Apparel;Nike;;KIMS EMBROIDERY;8770 SW Burnham Street;Portland;Oregon;97223;USA;AMERICAS;5;3;60;0
KITAI CO., LTD;FINISHED GOODS;Apparel;Nike;;KITAI;32 taka;kashiba;Nara;639-0241;Japan;N ASIA;73;61;65;2
KKN Apparel Co.,ltd;FINISHED GOODS;Apparel;Nike;Collegiate;NICE APPAREL;KKSEZ Neangkok Paklong Commune  Modulsiem Koh Kong  Cambodia;Koh Kong;Kaoh Kong;9401;Cambodia;SE ASIA;7567;6842;62;0
Kunshan Sabrina Clothes Making Co., Ltd.;FINISHED GOODS;Apparel;Nike;Collegiate;SABRINA;No 31 Kongxiang East Road;Kunshan;Jiangsu;215331;China;N ASIA;860;751;90;0
KUO YUEN (TR1) (CHINA);MATERIALS;Footwear;Nike;;KUO YUEN;NO 2 Jing Cheng 2 Road Huang Jiang Dong Guan China;Dongguan;Guangdong;523750;China;N ASIA;205;152;41;0
KUO YUEN (VIETNAM);MATERIALS;Footwear;Nike;;KUO YUEN;NHON TRACH 3 INDUSTRIAL ZONE NHON TRACH DISTRICT;Dong Nai;Ðng Nai;810000;Vietnam;SE ASIA;252;183;70;6
KUO YUEN (VIETNAM) TAY NINH;MATERIALS;Footwear;Nike;;KUO YUEN;Thanh Thanh Cong Industrial Zone;Trang Bang;Tây Ninh;840000;Vietnam;SE ASIA;414;347;40;6
KURARAY CO LTD (CLARINO) (TR1) (TR1) (CHINA);MATERIALS;Footwear;Nike;;KURARAY;NO 1568 Dongfang Road Jiaxing;Jiaxing Zhejiang;Zhejiang;314031;China;N ASIA;390;200;60;0
KURARAY CO LTD (CLARINO) (TR1) (TR1) (TAIWAN);MATERIALS;Footwear;Nike;;KURARAY;1 2 1  Kaigan dori  Minami ku;Osaka;Okayama;7028601;Japan;N ASIA;1700;1400;40;0
KURARAY CO LTD (CLARINO) (TR1) (VIETNAM);MATERIALS;Footwear;Nike;;KURARAY;NO 9 8TH STREET VSIP THUAN AN DISTRICT;THUAN AN CITY;Bình Duong;75200;Vietnam;SE ASIA;130;100;50;3
League Optical(Zhongshan) Workshop Limited;FINISHED GOODS;Equipment;Nike;;ARTS OPTICAL;Yaguan building 3;Zhongshan ;Guangdong;528463;China;N ASIA;67;60;51;0
SP Apparel Inc.;FINISHED GOODS;Apparel;Nike;;SP APPAREL;6935 rue Picard;St-Hyacinthe;Quebec;J2S 1H3;Canada;AMERICAS;255;200;80;5
LI CHENG ENTERPRISE CO.,LTD;FINISHED GOODS - COMPONENTS;Footwear;Nike;;LI CHENG ENTERPRISE;NO 5 DOU KUNG 12 ROAD DOU LIU CITY;Yun-Lin Hsien;Yunlin;64645;Taiwan;N ASIA;360;211;44;36
LIM SRL;FINISHED GOODS;Footwear;Converse;;LIM;VIA FRASSENARA 21;Montagnana;Padova;35044;Italy;EMEA;39;29;15;24
LION BROTHERS FAR EAST;FINISHED GOODS - COMPONENTS;Apparel;Nike;;LION BROTHERS;No  62 Upper North Lane 4 Shangnan Industrial Zone;Shenzhen;Guangdong;518125;China;N ASIA;355;265;51;0
Long Chuan Simona Footwear Co. Ltd;FINISHED GOODS;Footwear;Nike;Collegiate;STELLA;Xin cheng Long Chuan;HeYuan;Guangdong;517300;China;N ASIA;4546;3835;87;0
Long Fa Shoes Industrial Huizhou Co., Ltd.;FINISHED GOODS;Footwear;Nike;Collegiate;DEAN SHOES;LONGTING INDUS. PARK, LONGXI TOWN, BOLUO COUNTY;Huizhou;Guangdong;516121;China;N ASIA;6549;4988;57;0
Long Yue Shoes Industrial Hui Zhou Co.,Ltd.;FINISHED GOODS - COMPONENTS;Footwear;Nike;Collegiate;DEAN SHOES;Longting Industrial Zone Longxi Town Boluo County;Huizhou;Guangdong;516000;China;N ASIA;480;403;70;0
Longchuan Somona Footwear Co.,Ltd Wuhua Branch;FINISHED GOODS - COMPONENTS;Footwear;Nike;Collegiate;STELLA;Shuizhai Industry Garden;Meizhou;Guangdong;514400;China;N ASIA;882;828;92;0
Longhui Stella Footwear Co., Ltd;FINISHED GOODS - COMPONENTS;Footwear;Nike;Collegiate;STELLA;South east Industrial Park;Shaoyang City;Hunan;422200;China;N ASIA;730;641;89;0
Longway Vietnam Company Limited;FINISHED GOODS;Equipment;Nike;;LONGWAY;Lot HC1 Route 3 Xuyen A Industrial Zone;Duc Hoa;Long An;863900;Vietnam;SE ASIA;1275;1100;76;0
LONGWELL COMPANY LTD.;FINISHED GOODS;Footwear;Nike;;DEAN SHOES;Dau Giay Industrial Park,;Huyen Thong Nhat;Ðng Nai;81000;Vietnam;SE ASIA;5245;4605;90;0
Lotus Footwear Enterprises Limited Unit-2;FINISHED GOODS;Footwear;Nike;;FENG TAY;Plot 3C Sipcot Industrial Park Mangal Village Mathur post;Near Kanchipuram;Tamil Nadu;631701;India;S ASIA;4594;4476;63;0
Fairway Enterprises Company Ltd (India Branch) - Unit 1;FINISHED GOODS;Footwear;Nike;;FENG TAY;Plot no G 1B SIPCOT Industrial Park;KRISHNAGIRI;Tamil Nadu;635304;India;S ASIA;6513;6490;54;0
Lucky Star Vietnam Garment Company Limited;FINISHED GOODS;Apparel;Nike;;LUCKY STAR;No 108 part of lot D road No 3 Dong An IP Binh Hoa Ward;Thuan An ;Bình Duong;820000;Vietnam;SE ASIA;963;863;76;0
LUCKYTEX SOC TRANG VIETNAM CO., LTD;FINISHED GOODS;Apparel;Nike;;TUNTEX;LOT H AN NGHIEP INDUSTRIAL ZONE AN HIEP  WARD;Soc Trang;Sóc Trang;960000;Vietnam;SE ASIA;865;579;75;2
M S STYLE TEXTILE (PVT.) LIMITED (SUNDER) - unit VI;FINISHED GOODS;Apparel;Nike;Collegiate;STYLE TEXTILE;PLOT NO 143 to 146 and 151 to 155;Lahore;Punjab;54700;Pakistan;S ASIA;6014;5434;15;0
Majestic Athletic;FINISHED GOODS;Apparel;Nike;;FANATICS;2320 Newlins Mill Rd;Easton;Pennsylvania;18045;USA;AMERICAS;519;417;65;0
MANUFACTURE OF ARTISTIC BELT & ACCESSORIES CO., LTD.;FINISHED GOODS;Equipment;Nike;;ARTISTIC BELT AND ACCESSORIES;Factory 7, DE1B & DE1 St., My Phuoc 3 Industrial Park,;Ben Cat Town;Bình Duong;82575;Vietnam;SE ASIA;37;27;85;11
MAPLE COMPANY LIMITED;FINISHED GOODS;Apparel;Nike;;RAMATEX;No 120 Road No 14 VSIP Hai Phong Township;Hai Phong City;Hai Phong;4000;Vietnam;SE ASIA;2628;2223;72;0
Marbelys;FINISHED GOODS;Apparel;Nike;;MARBELYS;4ta Calle Final 4 00 zona 2;San Pedro Sacatepequez;Sacatepéquez;1058;Guatemala;AMERICAS;182;161;56;0
Marbelys 2;FINISHED GOODS;Apparel;Nike;;MARBELYS;5a Avenida 0 03 zona 2;San Pedro Sacatepequez;Sacatepéquez;1058;Guatemala;AMERICAS;104;101;56;0
Marchon Italia Srl a SU;FINISHED GOODS;Equipment;Nike;;MARCHON;V.le Alpago 151;Alpago;Belluno;32016;Italy;EMEA;283;143;59;0
MARVEL GARMENT CO.,LTD.;FINISHED GOODS;Apparel;Nike;;SHENZHOU;PPSEZ Beung Thom 3 village;Phnom Penh;Phnom Penh;120909;Cambodia;SE ASIA;14101;12909;88;3
MAS Active Pvt Ltd - Contourline Division;FINISHED GOODS;Apparel;Nike;;MAS HOLDINGS;No 231 Nawala Road;Nugegoda;Colombo;10240;Sri Lanka;S ASIA;2357;1739;84;0
MAS Al Safi Apparel Manufacturing LLC ;FINISHED GOODS;Apparel;Nike;;MAS HOLDINGS;Dulailet Alhamaideh Leb and Mlaih;Madaba;Madaba;11636;Jordan;EMEA;575;421;80;19
MAS Fabrics (Private) Limited - Matrix;FINISHED GOODS - COMPONENTS;Apparel;Nike;;MAS HOLDINGS;MAS Fabric park;Warakapola ;Kegalla;71610;Sri Lanka;S ASIA;1172;677;46;0
MAS FABRICS (PRIVATE) LIMITED – INTIMO DIVISION;MATERIALS;Apparel;Nike;;MAS HOLDINGS;MAS Fabric Park;Thulhiriya;Kurunegala;71610;Sri Lanka;S ASIA;1380;696;21;0
Mas Fabrics Pvt Ltd - Methliya;FINISHED GOODS;Apparel;Nike;Collegiate;MAS HOLDINGS;Mas Fabric Park;Kegalle;Kegalla;71000;Sri Lanka;S ASIA;2885;2282;86;0
MAS KREEDA  Vaanavil ;FINISHED GOODS;Apparel;Nike;;MAS HOLDINGS;Plot No 2 Agriculture Faculty Road;Kilinochchi;Kilinochchi;42000;Sri Lanka;S ASIA;2353;2272;67;0
MAS KREEDA Balangoda ;FINISHED GOODS;Apparel;Nike;;MAS HOLDINGS;Weligepola Road;Balangoda;Ratnapura;70100;Sri Lanka;S ASIA;1170;1075;90;0
MAS KREEDA Intimo;FINISHED GOODS;Apparel;Nike;;MAS HOLDINGS;Lot 49 58 59 BEPZ;Colombo;Colombo;42000;Sri Lanka;S ASIA;235;165;85;0
MAS KREEDA Mihintale ;FINISHED GOODS;Apparel;Nike;;MAS HOLDINGS;Isuru Uyana;Mihintale;Anuradhapura;50300;Sri Lanka;S ASIA;1121;956;96;0
MAS KREEDA Shadeline ;FINISHED GOODS;Apparel;Nike;Collegiate;MAS HOLDINGS;MAPAKADEWEWA;MAHIYANGANAYA;Monaragala;90730;Sri Lanka;S ASIA;156;123;85;0
MAS KREEDA Synergy ;FINISHED GOODS;Apparel;Nike;Collegiate;MAS HOLDINGS;A3 Seethawaka Export Processing zone;Avissawella;Colombo;10700;Sri Lanka;S ASIA;2432;2312;65;0
MAXIM IMPRESSION LANKA (PVT) LTD;MATERIALS;Apparel;Nike;;MAXIM;62 4 Habarakada Homagama;Homagama;Colombo;10200;Sri Lanka;S ASIA;168;96;28;0
Maxim Label and Packaging Vietnam Co., Ltd;MATERIALS;Apparel;Nike;;MAXIM;No 33  6th Street;Thuan An;Bình Duong;72000;Vietnam;SE ASIA;661;391;54;3
MAXIM SMART MANUFACTURING CO LTD;MATERIALS;Apparel;Nike;;MAXIM;No 398 Jinxiu Rd Yaozhuang Town Jiashan;Jiaxing;Zhejiang;314117;China;N ASIA;590;293;62;0
Maxport Limited (Viet Nam) - Thai Binh Branch;FINISHED GOODS;Apparel;Nike;Collegiate;MAXPORT;Lot with area of 110238 m2;Vu Thu;Thái Bình;410000;Vietnam;SE ASIA;2755;2341;75;0
MAXPORT LIMITED VIET NAM _ NAM DINH BRANCH MAXPORT 06;FINISHED GOODS;Apparel;Nike;Collegiate;MAXPORT;No 361 Nguyen Van Troi;Nam Dinh;Nam Ðnh;42000;Vietnam;SE ASIA;453;402;87;0
MAXPORT LIMITED VIET NAM NAM DINH BRANCH MAXPORT 05;FINISHED GOODS;Apparel;Nike;Collegiate;MAXPORT;Lot No85 Map No44;Nam Dinh;Nam Ðnh;42000;Vietnam;SE ASIA;1504;1222;83;0
MEN CHUEN VIETNAM CO.,  LTD.;MATERIALS;Apparel;Nike;;MEN CHUEN;7A Road Nhon Trach II Industrial Zone;Dong Nai;Ðng Nai;810000;Vietnam;SE ASIA;255;82;36;37
Milteks Tekstil Sanayi ve Ticaret A S;FINISHED GOODS;Apparel;Nike;;MILTEKS;Bakir ve Pirinc Sanayicileri Sitesi;Istanbul;Istanbul;34520;Turkey;EMEA;182;85;43;0
Milteks Tekstil Sanayi Ve Ticaret A.S. Ajara Textile Ltd;FINISHED GOODS;Apparel;Nike;;MILTEKS;3 Tbeti Street, King Tamara Distr.;Batumi;Ajaria;6001;Georgia;EMEA;671;582;88;0
Minone Enterprises Co Ltd;FINISHED GOODS;Equipment;Nike;Collegiate;MINONE;253 MOO 6 NONGBOT SUBDISTRICT;NANGRONG;Buri Ram;31110;Thailand;SE ASIA;599;474;77;0
NAM THIEN COMPANY LIMITED;FINISHED GOODS;Apparel;Nike;Collegiate;SOUTH ISLAND;Lot IV No 13 No 4 Street;Ho Chi Minh;Ho Chi Minh;700000;Vietnam;SE ASIA;466;402;78;0
NAN YANG;MATERIALS;Apparel;Nike;;NAN YANG;19 Moo 5 Setakit Road Tamai;Krathoomban;Samut Sakhon;74000;Thailand;SE ASIA;788;655;46;40
Nan Yang Garment;FINISHED GOODS;Apparel;Nike;Collegiate;NAN YANG;37 Moo 5 Ladyao Banrai Rd;Ladyao Nakhonsawan;Nakhon Sawan;60150;Thailand;SE ASIA;1029;605;78;0
NAN YANG GARMENT CO., LTD.;FINISHED GOODS;Apparel;Nike;Collegiate;NAN YANG;27 Phetkasem Rd;Nongkham;Bangkok;10160;Thailand;SE ASIA;1130;945;66;70
Nan Yang Garment Co., Ltd.;FINISHED GOODS;Apparel;Nike;Collegiate;NAN YANG;99 1 Moo 4 Banna;Wachirabaramee;Phichit;66140;Thailand;SE ASIA;1672;1550;76;0
NAN YANG GARMENT CO.,LTD;FINISHED GOODS;Apparel;Nike;Collegiate;NAN YANG;166 168 170 172 Moo 1;Sampran;Nakhon Pathom;73110;Thailand;SE ASIA;1425;1365;65;82
Nantong Nafung Gym Equipment Co.,Ltd;FINISHED GOODS;Equipment;Nike;;NNG;Group 2 Tongshan Village Yuelai Town Haimen District;Nantong;Jiangsu;226131;China;N ASIA;26;22;54;0
National Emblem Wang Chu Embroidery Co.;FINISHED GOODS - COMPONENTS;Apparel;Nike;;NATIONAL EMBLEM;5F  No 3  Aly 11 Ln  327;New Taipei City;New Taipei;Zhonge District;Taiwan;N ASIA;14;10;100;40
NICE APPAREL COMPANY LIMITED;FINISHED GOODS;Apparel;Nike;Collegiate;NICE APPAREL;2 7 8 slash 1 to 3 Soi Ngamwongwan 25  Yaek 19;MUANG DISTRICT;Nonthaburi;11000;Thailand;SE ASIA;1067;666;71;38
NICE APPAREL COMPANY LIMITED;FINISHED GOODS;Apparel;Nike;Collegiate;NICE APPAREL;369 Moo 4 Manjakiri Road Muang Khonkaen;Khonkaen;Khon Kaen;40000;Thailand;SE ASIA;1134;688;68;0
