Factory Name;Factory Type;Product Type Type;Nike, Inc. Brand(s);Events;Supplier Group;Address;City;State;Postal Code;Country / Region;Region;Total Workers;Line Workers;% Female Workers;% Migrant Workers
Nice Apparel Company Limited Branch Chumphae;FINISHED GOODS;Apparel;Nike;;NICE APPAREL;219 Moo 2 Maliwan Road T Non Udom;Chumpae;Khon Kaen;40130;Thailand;SE ASIA;3294;3215;72;0
Ningbo Bell Garment Industrial Co. Ltd;FINISHED GOODS;Apparel;Nike;;NINGBO BELL;No 422 Jianghu Road Jiangbei Investment Zone C;Ningbo;Zhejiang;315033;China;N ASIA;127;104;74;0
Ningbo Eastex;FINISHED GOODS;Apparel;Nike;Collegiate;NINGBO EASTEX;No 218 Shun Tai Road Zhenhai District;Ningbo;Zhejiang;32151;China;N ASIA;180;153;50;0
Ningbo Huayao Textile co.,ltd;FINISHED GOODS;Apparel;Nike;Collegiate;SHENZHOU;No 888 Tinhai Road Chunxiao Industrial Zone;Ningbo;Zhejiang;315800;China;N ASIA;613;550;86;0
NINGBO MITSUBANA APPERAL CO., LTD;FINISHED GOODS;Apparel;Converse;;NINGBO MITSUBANA;NO 1338 YUFAN ROAD E ZHENHAI;NINGBO;Zhejiang;315207;China;N ASIA;76;72;79;0
Ningbo Shenzhou Knitting Co. Ltd;FINISHED GOODS;Apparel;Nike;Collegiate;SHENZHOU;50 TianMuShan Road;Ningbo;Zhejiang;315800;China;N ASIA;2612;2447;71;0
NINGBO SHENZHOU KNITTING CO. LTD. (PRINTING MILL & MC);FINISHED GOODS;Apparel;Nike;Collegiate;SHENZHOU;NO 636 Fuchunjiang Road;Ningbo;Zhejiang;315800;China;N ASIA;626;547;49;0
Ningbo Shenzhou Knitting Co. Ltd. -#6 Garment Factory;FINISHED GOODS;Apparel;Nike;Collegiate;SHENZHOU;INTERSECTION OF DAGANG ROAD 5th ROAD;NingBo;Zhejiang;315800;China;N ASIA;2352;2100;70;0
NINGBO SHENZHOU KNITTING CO., LTD;MATERIALS;Apparel;Nike;;SHENZHOU;No 18 Yongjiang Rd;Ningbo;Zhejiang;315800;China;N ASIA;5434;4955;38;0
NV Apparel Company Limited;FINISHED GOODS;Apparel;Nike;Collegiate;NICE APPAREL;Lot C1 Binh Hoa Industrial Zone Chau Thanh An Giang;An Giang;An Giang;880000;Vietnam;SE ASIA;2999;2882;78;0
Olive Apparel (Cambodia) Co., Ltd;FINISHED GOODS;Apparel;Nike;;RAMATEX;National Road No 3 Phum Prey Kambot;Phnom Penh;Phnom Penh;12405;Cambodia;SE ASIA;3404;3166;89;0
Oregon Screen Impressions, Inc.;FINISHED GOODS;Apparel;Nike;;OREGON SCREEN IMPRESSIONS;3580 NE Broadway;Portland;Oregon;97232;USA;AMERICAS;101;71;65;0
ORIENTAL GARMENT AN GIANG CO LTD;FINISHED GOODS;Apparel;Nike;;ORIENTAL GARMENT;PLOT K BINH HOA IZ BINH HOA COMMUNE CHAU THANH DISTRICT;AN GIANG;An Giang;90000;Vietnam;SE ASIA;607;529;81;0
Oriental Garment Co., Ltd – Nongbuadang;FINISHED GOODS;Apparel;Nike;;ORIENTAL GARMENT;178 Moo 17;Nongbuadang;Chaiyaphum;36210;Thailand;SE ASIA;349;346;71;0
ORIGINAL APPAREL PRIVATE LIMITED;FINISHED GOODS;Apparel;Nike;;MAS HOLDINGS;Weerawila Junction ;Weerawila;Hambantota;82632;Sri Lanka;S ASIA;540;464;85;0
Pacific Athletic Wear, Inc. ;FINISHED GOODS;Apparel;Nike;;PACIFIC ATHLETIC WEAR;7340 Lampson Avenue;Garden Grove;California;92841;USA;AMERICAS;101;86;65;0
PAIHO (DONGGUAN 3);MATERIALS;Footwear;Nike;;PAIHO GROUP;HUANBAO INDUSTRY DISTRICT;DONGGUAN;Guangdong;523998;China;N ASIA;1800;950;55;0
PAIHO (TAIWAN)- Knitting;MATERIALS;Footwear;Nike;;PAIHO GROUP;NO 575 HO KANG ROAD HO MEI TOWN CHANG HUA HSIEN,CHANG HUA HSIEN,Changhua;CHANG HUA HSIEN;Changhua;50844;Taiwan;N ASIA;813;462;58;43
PAIHO (VIETNAM);MATERIALS;Footwear;Nike;;PAIHO GROUP;Lot 30 32 34 No3 Road Tan Tao Industrial Park;Ho Chi Minh City;Ho Chi Minh;71909;Vietnam;SE ASIA;3097;2481;53;2
PAIHO (WUXI 1);MATERIALS;Apparel;Nike;;PAIHO GROUP;NO 18 HEXIN RD XISHAN ECONOMIC DEVELOPMENT ZONE;WUXI CITY;Jiangsu;214101;China;N ASIA;981;685;80;2
Papillion Textile (Cambodia) Co., Ltd;FINISHED GOODS;Apparel;Nike;;TUNTEX;Vattanac II Industry Park National Road No 3;Phnom Penh;Phnom Penh;120505;Cambodia;SE ASIA;1161;1054;95;0
Paramount Apparel International, LLC.;FINISHED GOODS;Apparel;Nike;Collegiate;PARAMOUNT;1916 Imperial Way;Bourbon;Missouri;65441;USA;AMERICAS;293;92;60;0
Paramount Apparel LLC. Winona MO;FINISHED GOODS;Apparel;Nike;Collegiate;PARAMOUNT;Highway 19;Winona;Missouri;65588;USA;AMERICAS;115;109;60;0
Paxar Packaging Guangzhou Ltd.;MATERIALS;Apparel;Nike;;AVERY DENNISON;Tan Shan Village  Hua Long Town  Panyu;Guangzhou;Guangdong;511434;China;N ASIA;4049;2756;47;0
PETTENATI;FINISHED GOODS;Apparel;Nike;;PETTENATI;Rod RSC 453 Km 2 4;Caxias Do Sul;Rio Grande do Sul;95010.550;Brazil;AMERICAS;596;478;88;5
PETTENATI CENTRO AMERICA S.A. DE C.V.;MATERIALS;Apparel;Nike;;PETTENATI;Km 42 Carretera A Santa Ana; Coatepeque;Santa Ana;2204;El Salvador;AMERICAS;850;760;20;1
PHUC TAI TAY NINH CO., LTD;FINISHED GOODS;Footwear;Nike;;SPORTS GEAR;Lot B7 Tan Hoi Industrial cluster;Tay Ninh;Tây Ninh;80000;Vietnam;SE ASIA;350;309;85;0
Pilotknit Sport Wear Co.,ltd.;FINISHED GOODS;Apparel;Nike;;PILOT;89 13 Moo 2 Rama ll Road T Kokkrabur;Muang;Samut Sakhon;74000;Thailand;SE ASIA;752;656;64;83
Pine Tree Company for Textile Manufacturing PSC;FINISHED GOODS;Apparel;Nike;;RAMATEX;AL-MUWAQQAR INDUSTRIAL ESTATE;AMMAN;Amman;110109;Jordan;EMEA;2286;2039;69;76
Pinghu Lipai Bags and Luggage Co., Ltd.;FINISHED GOODS;Equipment;Nike;;PINGHU LIPAI;No123 Hehe Road;Pinghu;Zhejiang;314200;China;N ASIA;191;163;75;0
Pingxiang City Guangxuan Footwear Co. Ltd.;FINISHED GOODS - COMPONENTS;Footwear;Nike;Collegiate;SHOETOWN;Zhuting industrial zone, Xuanfeng town, Luxi county Pingxiang city,;Pingxiang;Jiangxi;337000;China;N ASIA;842;760;95;0
PMI Joinease plastic & metal products;FINISHED GOODS;Equipment;Nike;;PMI JOINEASE;Mutoutan Group No 2 Lizhidun Villiage;Hui Zhou;Guangdong;516131;China;N ASIA;1121;854;49;0
PONY LEATHER CORPORATION (TAIWAN);MATERIALS;Footwear;Nike;;PONY LEATHER CORPORATION;NO 191 SEC 3 CHUNG SHAN ROAD;Changhua;Changhua;512;Taiwan;N ASIA;250;190;40;0
Pou Chen Corporation;FINISHED GOODS;Footwear;Nike;;POU CHEN;No. 2, Fugong Rd, Fuxing Township;Changhua;Changhua;506;Taiwan;N ASIA;1750;512;64;0
Pou Chen Vietnam Enterprise Ltd.;FINISHED GOODS;Footwear;Nike;;POU CHEN;Nguyen Ai Quoc Street, An Hoa Quarter, Hoa An Ward,;Bien Hoa City;Ðng Nai;76123;Vietnam;SE ASIA;16060;12339;83;0
POVOLO SRL;FINISHED GOODS;Apparel;Nike;;POVOLO;VIA GRAN BRETAGNA 1;Gallarate;Varese;21013;Italy;EMEA;24;16;92;31
PPSEC COMPANY LIMITED;FINISHED GOODS - COMPONENTS;Apparel;Nike;;SEC ACCESSORIES;Phnom Penh Special Economic Zone;Phnom Penh;Phnom Penh;120907;Cambodia;SE ASIA;370;220;6;7
PRIME ASIA (CHINA);MATERIALS;Footwear;Nike;;PRIME ASIA;YUE YUEN INDUSTRIAL PARK;Dongguan,Guangdong;Guangdong;511700;China;N ASIA;878;588;37;0
PRIME ASIA (VIETNAM);MATERIALS;Footwear;Nike;;PRIME ASIA;LOT V 2 MY XUAN A2 INDUSTRIAL ZONE TAN THANH DISTRICT;VungTau;Bà Ra - Vung Tàu;78000;Vietnam;SE ASIA;1428;940;58;0
Pro Kingtex Vietnam Co., Ltd;FINISHED GOODS;Apparel;Nike;Collegiate;EAGLE NICE;D10/89 Q National High Way 1A Tan Tao Ward Binh Tan District;HO CHI MINH CITY;Ho Chi Minh;700000;Vietnam;SE ASIA;2087;1227;83;1
PROMAX TEXTILE (VIETNAM) CO. LTD;MATERIALS;Apparel;Nike;;PROMAX TEXTILE;NO 33 6TH ROAD FORMOSA ZONE;Dong Nai;Ðng Nai;76000;Vietnam;SE ASIA;868;788;20;3
PT Adis Dimension Footwear;FINISHED GOODS;Footwear;Nike;Collegiate;SHOETOWN;Jl. Raya Serang Km. 24;Tangerang;Banten;15610;Indonesia;S ASIA;8623;8364;51;0
PT Batang Apparel Indonesia;FINISHED GOODS;Apparel;Nike;;KUKDONG;Nanom Desa Wringin Gintung Kecamatan;Batang;Jawa Tengah;51261;Indonesia;S ASIA;2163;2024;84;0
PT Chang Shin Indonesia;FINISHED GOODS;Footwear;Nike;;CHANGSHIN;Jl Ir H Juanda No 008;Karawang;Jawa Barat;41374;Indonesia;S ASIA;2058;1828;78;0
PT DAEWON ECO INDONESIA;MATERIALS;Footwear;Nike;;DAEWON;Jl Pinang Blok F23 No 11E and 11F Delta Silicon 3;Bekasi;Jawa Barat;17530;Indonesia;S ASIA;37;20;9;25
PT Dayup Indo;FINISHED GOODS;Equipment;Nike;Collegiate;DAYUP;NUSANTARA BONDED ZONE KBN MADURA STREET 6 BLOCK D13A;JAKARTA;Jakarta Raya;14140;Indonesia;S ASIA;1220;1118;94;0
PT Eagle Nice Indonesia;FINISHED GOODS;Apparel;Nike;Collegiate;EAGLE NICE;JL Raya Serang;Kabupaten Serang;Banten;42186;Indonesia;S ASIA;2906;1989;73;1
PT ECLAT TEXTILE INTERNATIONAL;FINISHED GOODS;Apparel;Nike;Collegiate;ECLAT;Jl SAPTARENGGA No 11 Kel Wonorejo Kec Kaliwungu;Kendal;Jawa Tengah;51372;Indonesia;S ASIA;3041;2843;95;1
PT KMK Global Sports / K1;FINISHED GOODS;Footwear;Nike;;KMK;Cikupa Mas Industrial Estate and Warehouse;Tangerang;Banten;15710;Indonesia;S ASIA;9970;8194;85;0
PT Lucky Textile Semarang Demak;FINISHED GOODS;Apparel;Nike;;TUNTEX;Dukuh Tegalrejo RT 001 RW 002;Demak;Jawa Tengah;59571;Indonesia;S ASIA;1442;1192;95;1
PT Marel Sukses Pratama;FINISHED GOODS;Equipment;Converse;;PTM;JL Baru Mulungan Gondang Penen ;Yogyakarta;Yogyakarta;55285;Indonesia;S ASIA;166;124;41;0
PT MAS ARYA INDONESIA;FINISHED GOODS;Apparel;Nike;;MAS HOLDINGS;Tugu Wijaya Road VI 7 Kawasan Industri;Semarang;Jawa;50181;Indonesia;S ASIA;2110;1960;100;1
PT Mercindo Global Manufaktur;FINISHED GOODS;Equipment;Nike;;MERCINDO;Jl Raya Semarang Bawen Km 29 Desa Samban Bawen;Ungaran;Jawa Tengah;50661;Indonesia;S ASIA;2416;2287;72;0
PT Mitra Garindo Perkasa;FINISHED GOODS;Apparel;Nike;;MAP;JL Pancasila V 21 Cicadas Gunung Putri Bogor;Bogor;Jawa Barat;16964;Indonesia;S ASIA;759;658;86;0
PT Morich Indo Fashion;FINISHED GOODS;Apparel;Nike;;MORICH;JL RAYA KARANGJATI KM 25 GEMBONGAN KARANGJATI BERGAS;UNGARAN;Jawa Tengah;50552;Indonesia;S ASIA;2566;2450;78;0
PT Nikomas Gemilang;FINISHED GOODS;Footwear;Nike;;POU CHEN;Jalan Raya Serang KM71 Desa Tambak Kibin;Serang;Banten;42186;Indonesia;S ASIA;23522;19181;84;0
PT PAXAR INDONESIA (AVERY DENNISON GROUP);MATERIALS;Apparel;Nike;;AVERY DENNISON;Jalan Inti1  Blok C1 No 14;Bekasi;Jawa Barat;17550;Indonesia;S ASIA;488;350;20;0
PT Pratama Abadi Industri;FINISHED GOODS;Footwear;Nike;;PRATAMA;Jl. Raya Serpong Km. 7;Tangerang Selatan;Banten;15325;Indonesia;S ASIA;5657;4479;83;0
PT PRATAMA ABADI INDUSTRI;FINISHED GOODS;Footwear;Nike;;PRATAMA;Jalan Raya Bandung Tasikmalaya KM 43 Desa Cijolang;Garut;Jawa Barat;44186;Indonesia;S ASIA;6729;6401;94;0
PT PRATAMA ABADI INDUSTRI;FINISHED GOODS;Footwear;Nike;;PRATAMA;Jl Sukabumi Cianjur KM14 Sukabumi West Java;Sukabumi;Jawa Barat;43191;Indonesia;S ASIA;15665;13738;82;0
PT Rodeo Prima Jaya;FINISHED GOODS;Apparel;Nike;;PRIMA;Jl Raya Kaligawe Km 7 Semarang;Semarang;Jawa Tengah;50117;Indonesia;S ASIA;609;560;89;0
PT SELALU CINTA INDONESIA;FINISHED GOODS;Footwear;Nike;;KMK;JL LINGKAR SELATAN SALATIGA DUSUN TETEP ;SALATIGA;Jawa Tengah;50735;Indonesia;S ASIA;13988;11601;84;0
PT Semarang Garment;FINISHED GOODS;Apparel;Nike;Collegiate;KUKDONG;JL Soekarno Hatta Km 25;Semarang;Jawa Tengah;50552;Indonesia;S ASIA;3646;3383;94;0
PT Shoetown Kasokandel Indonesia;FINISHED GOODS - COMPONENTS;Footwear;Nike;Collegiate;SHOETOWN;Jalan Raya Sumedang Cirebon;Majalengka;Banten;45453;Indonesia;S ASIA;4943;4503;49;0
PT Sport Glove Indonesia ;FINISHED GOODS;Equipment;Nike;;PT SPORT;Dusun Krandon Desa Pandowoharjo Sleman Yogyakarta Indonesia;Sleman;Yogyakarta;55512;Indonesia;S ASIA;1626;1429;76;0
PT Tong Hong Tannery;MATERIALS;Footwear;Nike;;TONG HONG;KAWASAN INDUSTRI MODERN CIKANDE ;Kabupaten Serang;Banten;42186;Indonesia;S ASIA;287;237;45;3
PT Trigoldenstar Wisesa;FINISHED GOODS;Apparel;Nike;;TRIGOLDENSTAR;Jl Rumambe Desa Anggadita Kec Klari;Karawang;Jawa Barat;41371;Indonesia;S ASIA;132;98;80;0
PT Tuntex Garment Indonesia-TGR;FINISHED GOODS;Apparel;Nike;;TUNTEX;JLN MOH TOHA KM2 No 29;Tangerang;Banten;15112;Indonesia;S ASIA;41;1;98;100
PT Victory Chingluh Indonesia;FINISHED GOODS;Footwear;Nike;;CHING LUH;JL Raya Pasarkemis Rajeg;Tangerang;Banten;15560;Indonesia;S ASIA;4322;4019;55;0
PT Victory Chingluh Indonesia;FINISHED GOODS;Footwear;Nike;;CHING LUH;Jl. Otonom Pasar Kemis No.48/49 RT.003/RW.004, Pasar Kemis;Tangerang;Banten;15560;Indonesia;S ASIA;15580;13439;74;0
PT YC TEC INDONESIA;FINISHED GOODS - COMPONENTS;Footwear;Nike;;YC TEC CORPORATION;Kp Cisantri RT 002 RW001;Purwakarta;Jawa Barat;41181;Indonesia;S ASIA;746;679;60;1
PT. CCH INDONESIA;FINISHED GOODS;Apparel;Nike;;CHUAN CHENG;Jl Desa Giriasih No 16;Bandung Barat;Jawa Barat;40552;Indonesia;S ASIA;1840;1695;61;0
PT. CHANGSHIN  REKSA JAYA;FINISHED GOODS;Footwear;Nike;;CHANGSHIN;Kp Karang Mekar RT 002 RW 008;GARUT;Jawa Barat;44152;Indonesia;S ASIA;10921;9611;97;0
PT. CHING LUH INDONESIA;FINISHED GOODS;Footwear;Nike;;CHING LUH;JL. Raya Serang Km.16;Cikupa;Banten;15710;Indonesia;S ASIA;9447;8615;77;0
PT. DEAN SHOES;FINISHED GOODS;Footwear;Nike;;DEAN SHOES;Dusan Serang RT 10 RW 05;Karawang Timur;Jawa Barat;41373;Indonesia;S ASIA;3338;2971;90;1
PT. Feng Tay Indonesia Enterprises;FINISHED GOODS;Footwear;Nike;;FENG TAY;Jl Raya Banjaran Km 14 6;Bandung;Jawa Barat;40376;Indonesia;S ASIA;16185;14126;64;0
PT. Formosa Bag Indonesia;FINISHED GOODS;Equipment;Nike;;FORMOSA;Jl Raya Semarang Puwodadi Km 26 Gebangan Tegowanu;Grobogan;Jawa Tengah;58165;Indonesia;S ASIA;5367;4349;81;1
PT. Gelindo Garmentama;FINISHED GOODS;Apparel;Nike;;EAGLE NICE;Jalan Cangkuang Kulon No 38;Bandung;Jawa Barat;40239;Indonesia;S ASIA;2013;1793;55;0
PT. Grand Best Indonesia;FINISHED GOODS;Apparel;Nike;;TUNTEX;Jl Coaster No 8 Blok B 18 19 20 21 22;SEMARANG;Jawa Tengah;50174;Indonesia;S ASIA;1652;1506;94;0
PT. Kanindo Makmur Jaya;FINISHED GOODS;Equipment;Nike;Collegiate;KANAAN;Jalan Raya Jepara Kudus Km 19 Dusun Pendosawalan;Jepara ;Jawa Tengah;59462;Indonesia;S ASIA;5352;5255;62;0
PT. POU YUEN INDONESIA;FINISHED GOODS;Footwear;Nike;;POU CHEN;JALAN RAYA CIANJUR BANDUNG KM7, KAMPUNG LEMBUR SAWAH;CIANJUR;Jawa Barat;43284;Indonesia;S ASIA;12122;9959;57;0
PT. SHOETOWN LIGUNG INDONESIA;FINISHED GOODS;Footwear;Nike;Collegiate;SHOETOWN;JALAN LANUD SUKANI, DESA BUNTU;MAJALENGKA;Jawa Barat;45456;Indonesia;S ASIA;11440;9852;36;0
PT. TKG TAEKWANG INDONESIA;FINISHED GOODS;Footwear;Nike;;TAEKWANG;Belendung II RT 17 RW 06;Belendung, Cibogo;Jawa Barat;41285;Indonesia;S ASIA;27990;23692;87;0
PT.WONEEL MIDAS LEATHERS;FINISHED GOODS;Equipment;Nike;;PT. Woneel Midas Leathers;Bangunsari Rt04 Rw03 Candirejo Semin;Gunung kidul;Yogyakarta;55854;Indonesia;S ASIA;1443;1314;74;0
Qingdao Changshin Shoes Co., Ltd.;FINISHED GOODS;Footwear;Nike;;CHANGSHIN;Matiquan Road 6;QingDao;Shandong;266300;China;N ASIA;2782;2307;90;0
Qingdao Changshin Shoes Co., LTD. Jimo Factory;FINISHED GOODS;Footwear;Nike;;CHANGSHIN;Mocheng Road59 2;Qingdao;Shandong;266200;China;N ASIA;426;351;42;0
Qingyuan City Liannan Yao Nationality Autonomous County Rongfang Footwear;FINISHED GOODS;Footwear;Nike;Collegiate;SHOETOWN;50 Yan Jiang East Road,San Jiang Town Lian Nan County;QING YUAN;Guangdong;513300;China;N ASIA;758;703;96;0
QUANG VIET ENTERPRISE CO., LTD;FINISHED GOODS;Apparel;Nike;;QUANG VIET;UNIT 2  CU CHI TOWN;HO CHI MINH;Ho Chi Minh;70000;Vietnam;SE ASIA;5332;4787;88;0
Quanzhou  Fengze Yisheng Leather Co;FINISHED GOODS;Equipment;Converse;;QFY;BUILDING 3  SOUTH  XUNMEI  INDUSTRY  DISTRICT;Quanzhou;Fujian;362000;China;N ASIA;38;31;53;0
Quanzhou Unison Light Industrial Manufacturing Co. Ltd.;FINISHED GOODS;Equipment;Nike;;QUANZHOU UNISON LIGHT INDUSTRIAL;ROOM28 YANGSHI STREET JINLONG YUXIA PARK;Quanzhou;Fujian;362000;China;N ASIA;62;49;65;0
R. A. INTERTRADING S. A.;FINISHED GOODS;Apparel;Nike;;RA INTERTRADING;JOSE IGNACIO RUCCI 3951;CAPITAL FEDERAL;Buenos Aires;C1439FVQ;Argentina;AMERICAS;810;700;45;60
Ramatex Apparel Suzhou Ltd.;FINISHED GOODS;Apparel;Nike;;RAMATEX;115 Ting Nan Lu, Wei Ting Town, Suzhou Industrial Park,;Suzhou;Jiangsu;215121;China;N ASIA;596;551;92;0
Ramatex Printing Garment (Suzhou) Ltd;MATERIALS;Apparel;Nike;;RAMATEX;168 Liufeng Road;Suzhou;Jiangsu;215124;China;N ASIA;570;495;35;0
Ramatex Textiles Industrial Sdn Bhd;MATERIALS;Apparel;Nike;;RAMATEX;PLO 230 Sri Gading Industrial Estate;Johor;Johor;83000;Malaysia;S ASIA;3678;3301;15;71
Regent Garment Factory Ltd ;FINISHED GOODS;Apparel;Nike;;CRYSTAL;KCN Lai Vu  H Kim Thanh T Hai Duong;Hai Duong;Hi Duong;170000;Vietnam;SE ASIA;1746;1470;80;0
Regina Miracle International Vietnam Co., Ltd;FINISHED GOODS;Apparel;Nike;Collegiate;REGINA MIRACLE;NO 9 East West Road VSIP Hai Phong;Hai Phong;Hai Phong;180000;Vietnam;SE ASIA;1876;1770;71;0
Regina Miracle Intimate Apparel Shenzhen Limited;FINISHED GOODS;Apparel;Nike;Collegiate;REGINA MIRACLE;No 5 Cengyao Industrial Estate;Shenzhen;Guangdong;518132;China;N ASIA;41;38;60;0
RIETVELD SERIGRAFIE BV;FINISHED GOODS;Apparel;Nike;;RIETVELD;INDUSTRIEWEG 50  2382 NW;Zoeterwoude Rijndijk;Zuid-Holland;2382NW;Netherlands;EMEA;31;22;42;45
Ripon Athletic;FINISHED GOODS;Apparel;Nike;;RIPON;290 Junction St, P.O. BOX 25;Berlin;Wisconsin;54923;USA;AMERICAS;140;120;95;0
RJ Liebe Athletic Lettering Co.;FINISHED GOODS - COMPONENTS;Apparel;Nike;;RJ LIEBE ATHLETIC LETTERING;582 Goddard Ave;Chesterfield;Missouri;63005;USA;AMERICAS;22;10;60;0
Robinson Manufacturing Company, Dayton;FINISHED GOODS;Apparel;Nike;Collegiate;ROBINSON;1184 Broadway;Dayton;Tennessee;37321;USA;AMERICAS;58;53;77;0
Rollsport Vietnam Footwear Limited;FINISHED GOODS;Footwear;Nike;;HUALI;Hoang Long Industrial Zone;Thanh Hoa;Thanh Hóa;440000;Vietnam;SE ASIA;17400;15804;91;0
ROLLSPORT VIETNAM FOOTWEAR LIMTED;MATERIALS;Footwear;Nike;;GREAT ASCENT TRADING LIMITED;TAY HO VILLAGE ;Tho Xuan;Thanh Hóa;440000;Vietnam;SE ASIA;2305;2216;86;0
RS/Tupa Ind. De Plastico Ltda;FINISHED GOODS - COMPONENTS;Footwear;Nike;;RS TUPA INDUSTRIA DE PLASTICOS;Rua Ivo Johann, 10;Novo Hamburgo;Rio Grande do Sul;93546640;Brazil;AMERICAS;175;127;73;0
Sabrina Cambodia Garment Manufacturing;FINISHED GOODS;Apparel;Nike;Collegiate;SABRINA;National Rd;Samrong Torng District;Kampong Spueu;111111;Cambodia;SE ASIA;5887;4211;93;0
SADESA THAILAND (KABINBURI);MATERIALS;Footwear;Nike;;SADESA;139 2 MOO 5 SUWANASSORN ROAD TAMBON NONSRI;Kabinburi;Prachin Buri;25110;Thailand;SE ASIA;735;577;32;0
SADESA THAILAND Sena;MATERIALS;Footwear;Nike;;SADESA;89 Moo 11 Samkok sena Road;Ayutthaya;Phra Nakhon Si Ayu;13110;Thailand;SE ASIA;574;401;17;0
Saigon Daryar Plastic Co.,Ltd;FINISHED GOODS;Equipment;Nike;;SAIGON DARYAR;27C DT743 street;Di An;Bình Duong;590000;Vietnam;SE ASIA;346;323;83;0
SAMBU FINE CHEMICAL CO LTD (INDONESIA);MATERIALS;Footwear;Nike;;SAMBU FINE CHEMICAL;Jl Kenari Raya Blok G2 12B Delta Silicon V;Kabupaten Bekasi;Jawa Barat;17530;Indonesia;S ASIA;55;37;6;22
SAMBU FINE CHEMICAL CO LTD (KOREA);MATERIALS;Footwear;Nike;;SAMBU FINE CHEMICAL;167 SEOBU RO 1637 BEON GIL;Gyungnam;Gyeongsangnamdo;50888;South Korea;N ASIA;105;50;19;2
SAMBU FINE CHEMICAL CO LTD (VIETNAM);MATERIALS;Footwear;Nike;;SAMBU FINE CHEMICAL;Dong Xoai1 Industrial Park;Tan Thanh Commune Dong Xoai City;Bình Phuc;67108;Vietnam;SE ASIA;323;178;30;12
SAMIL TEXTILE CO LTD (Korea);MATERIALS;Footwear;Nike;;SAMIL;191 7  Noksansaneopjungro;Busan;Busan Gwangyeogsi;46753;South Korea;N ASIA;46;20;52;0
SAN FANG (TR1) (CHINA);MATERIALS;Footwear;Nike;;SAN FANG;YUE YUEN INDUSTRIAL PARK;DONGGUAN, GUANGDONG;Guangdong;511700;China;N ASIA;307;225;20;0
SAN FANG (TR1) (INDONESIA);MATERIALS;Footwear;Nike;;SAN FANG;JL MODERN INDUSTRI IV NO 10 12 16;Serang , Banten;Banten;42100;Indonesia;S ASIA;487;396;20;5
SAN FANG (TR1) (TAIWAN);MATERIALS;Footwear;Nike;;SAN FANG;NO 402 FENGREN ROAD;Kaohsiung;Kaohsiung;814;Taiwan;N ASIA;687;396;12;14
SAN FANG (TR1) (VIETNAM);MATERIALS;Footwear;Nike;;SAN FANG;LOT II4 MY XUAN A2 INDUSTRIAL PARK;PHU MY TOWN;Bà Ra - Vung Tàu;78707;Vietnam;SE ASIA;1182;960;20;2
TKG TAEKWANG VINA JOINT STOCK COMPANY-BRANCH 3;FINISHED GOODS - COMPONENTS;Footwear;Nike;;TAEKWANG;Nguyen Tri Phuong Street;Bien Hoa City;Ðng Nai;76000;Vietnam;SE ASIA;1536;1409;94;0
Sarno Display S.r.l.;FINISHED GOODS;Equipment;Nike;;GATTO;Via Galileo Galilei 30;Carnate;Lombardia;20866;Italy;EMEA;88;53;58;0
Sato knit Co., Ltd;FINISHED GOODS;Apparel;Nike;;SATO KNIT;2653 -1 Kitahama-machi;Amakusa-city;Kumamoto;863 0011;Japan;N ASIA;37;34;92;41
Scavi Hue Company;FINISHED GOODS;Apparel;Nike;;SCAVI;Phong Dien Industrial Zone;Phong Dien;Tha Thiên-Hu;530000;Vietnam;SE ASIA;5915;5379;77;0
SELF MAGLIERIA SRL;FINISHED GOODS;Apparel;Nike;;SELF MAGLIERIA;VIA RISORGIMENTO 48;Vertemate con Minoprio;Como;22070;Italy;EMEA;31;28;93;0
SeoHeung Co., Ltd. (3D Printer Center);MATERIALS;Footwear;Nike;;SEOHEUNG;87 JangnimBeonyeong ro;Busan;Busan Gwangyeogsi;49464;South Korea;N ASIA;61;2;0;0
Sewing Jonah;FINISHED GOODS;Apparel;Nike;;SEWING JONAH;11 71 8 Chome Chikami Minami Ku;Kumamoto -city;Kumamoto;861 4101;Japan;N ASIA;40;37;87;27
SEYANG CORPORATION VIETNAM;FINISHED GOODS;Apparel;Nike;;SEYANG;PLOT NO. 54, NHAT TAN INDUSTRIAL COMPLEX, NHAT TAN COMMUNE,;KIMBANG DISTRICT;Hà Nam;400000;Vietnam;SE ASIA;420;380;90;0
SFO Apparel Inc. (Sewing & Cutting);FINISHED GOODS;Apparel;Nike;;SFO APPAREL;41 Park Place;Brisbane;California;94005;USA;AMERICAS;59;50;90;0
Shaanxi White River Apparel CO., LTD.;FINISHED GOODS;Apparel;Nike;;SPORTS CITY;South of Lijiazhuo community;Weinan City;Shaanxi;715600;China;N ASIA;800;470;55;0
SHAHI EXPORTS PVT LTD UNIT 26;FINISHED GOODS;Apparel;Nike;Collegiate;SHAHI;Plot No 44 51 SY;Mandya;Karnataka;571428;India;S ASIA;5520;5270;84;0
SHAN BEEN JEOU INDUSTRIAL CO LTD (TAIWAN);MATERIALS;Footwear;Nike;;SHAN BEEN;NO 60 LANE 132 SHA TIAN ROAD SECTION 2 DA DU DISTRICT;Taichung;Taichung;43244;Taiwan;N ASIA;59;40;53;38
Shandong Yuanchenghe Garment Co.,Ltd;FINISHED GOODS;Apparel;Nike;Collegiate;FAR EASTERN;Huan cheng Science and Technology Park;Taian City;Shandong;271400;China;N ASIA;186;146;89;0
ShangGao Yisen Industry Co. Ltd.;FINISHED GOODS;Footwear;Nike;;POU CHEN;Youzidong Jingjiang Town ShangGao County YiChun City;YiChun;Jiangxi;336400;China;N ASIA;8068;6534;87;0
SHANGHAI YKK ZIPPER CO LTD (MINGHANG BRANCH);MATERIALS;Apparel;Nike;;YKK;No 468 Luchun Road;Shanghai;Shanghai;200245;China;N ASIA;2;1;1;100
SHANGHAI YKK ZIPPER CO LTD (NANHUI);MATERIALS;Apparel;Nike;;YKK;1258 FeiDu Road Nanhui District;Shanghai;Jiangsu;201306;China;N ASIA;2;1;1;100
Shao Yang County SteIIa Footwear LTD ;FINISHED GOODS;Footwear;Nike;Collegiate;STELLA;Inside the industrial park of Shao Yang County;Shaoyang;Hunan;422100;China;N ASIA;1148;1068;96;0
ShaoYang LianTai SQ HanShou Upper Facility;FINISHED GOODS - COMPONENTS;Footwear;Nike;Collegiate;STELLA;Hanshou Industrial Park, Taizimiao Town, HanShou County;Chande City;Hunan;415907;China;N ASIA;930;861;99;0
SHAOYANG STELLA FOOTWEAR COMPANY LIMITED;FINISHED GOODS;Footwear;Nike;Collegiate;STELLA;JIXIAN ROAD;SHAOYANG CITY;Hunan;422000;China;N ASIA;4586;4015;84;0
SHENZHEN PENGYIFA INDUSTRIAL CO, LTD;FINISHED GOODS;Apparel;Nike;;SHENZHEN PENGYIFA;2ND FLOOR BUILDING A B5 1ST INDUSTRIAL RD BAHUADONG;SHENZHEN GUANGMING DISTRICT;Guangdong;518107;China;N ASIA;46;19;43;0
Shinhan Ind Co., Ltd;MATERIALS;Apparel;Converse;;SHINHAN;86 sanseong no danwon gu;Ansan City;Gyeonggido;15437;South Korea;N ASIA;158;93;58;6
SHINTA WOOSUNG PT (INDONESIA);MATERIALS;Footwear;Nike;;SHINTA WOOSUNG;JL RAYA KOPO MAJA KM 1;Serang;Banten;42100;Indonesia;S ASIA;246;198;48;13
SHIXING TIAN HE GARMENTS CO. LTD.;FINISHED GOODS;Apparel;Nike;;WONG LUEN;XING SHENG INDUSTRIAL PARK JIANG KOU TOWN;SHAO GUANG;Guangdong;511100;China;N ASIA;117;90;87;7
Shoetown Footwear Co.,Ltd;FINISHED GOODS;Footwear;Nike;Collegiate;SHOETOWN;Bapian Village Xuanzhen Road;Qingyuan City;Guangdong;511800;China;N ASIA;11366;9284;89;0
Shoetown Hunan FOOTWEAR CO.,LTD;FINISHED GOODS;Footwear;Nike;Collegiate;SHOETOWN;Deng Ta Road, Qiyang Development Zone;YongZhou City;Hunan;426100;China;N ASIA;2536;2126;86;0
Shoetown JinTan;FINISHED GOODS;Footwear;Nike;;SHOETOWN;Da Wan Gang Village;Qingyuan City;Guangdong;511515;China;N ASIA;950;873;91;0
Shoetown Lei Zhou Footwear Co., Ltd;MATERIALS;Footwear;Nike;;SHOETOWN FOOTWEAR CO LTD;Lei Nan street;Zhan Jiang City;Guangdong;524200;China;N ASIA;300;269;96;0
Shoetown Quan Zhou Footwear Co., Ltd;MATERIALS;Footwear;Nike;;SHOETOWN FOOTWEAR CO LTD;No 3 FuPing Garden;Gui Lin City;Guangxi;541500;China;N ASIA;559;515;85;0
Sidney Apparels LLC;FINISHED GOODS;Apparel;Nike;;QUANG VIET;PLOT 909 and 910 Lot 25;Aqaba;AlAqaba;77110;Jordan;EMEA;1456;1270;53;90
SIGMA VIETNAM INDUSTRIAL CO.,LTD;FINISHED GOODS;Equipment;Nike;;SIGMA;AV AVI GIAO LONG INDUSTRIAL PARK II AN PHUOC COMMUNE ;BENTRE;Bn Tre;86000;Vietnam;SE ASIA;1158;1047;75;0
SIMONA TANNING INC (CHINA);MATERIALS;Footwear;Nike;;SIMONA TANNING;No 8 High Tech 1st Road Buchang Town HuanBaoCheng;Yangjiang;Guangdong;529500;China;N ASIA;621;507;35;0
SMS Konfeksiyon Sanayi ve Ticaret A.S;FINISHED GOODS;Apparel;Nike;;YESIM;Firat Mah 943;Agri;Agri;4200;Turkey;EMEA;645;600;36;0
SNP CO.,LTD.;FINISHED GOODS;Apparel;Nike;;SPORTS CITY;No 12 VSIP II Road;Thu Dau Mot City;Bình Duong;75000;Vietnam;SE ASIA;2780;2456;90;0
SON KHA COMPANY LIMITED;FINISHED GOODS;Apparel;Nike;Collegiate;SOUTH ISLAND;441D Pham Van Chieu Street Ward 14 Go Vap District;Ho Chi Minh;Ho Chi Minh;700000;Vietnam;SE ASIA;53;47;70;0
Song Hong - Nghia Hung Garment Joint Stock Company;FINISHED GOODS;Apparel;Nike;;SONG HONG NGHIA HUNG COMPANY;Group 12 Nghia Phong Town Nghia Hung District;Nam Dinh;Nam Ðnh;420000;Vietnam;SE ASIA;1976;1543;80;0
Song Hong Garment Factory- Factory 11,12,13,14;FINISHED GOODS;Apparel;Nike;;SONG HONG;Hai Phuong industrial zone Hai Hau district;Nam Dinh;Nam Ðnh;420000;Vietnam;SE ASIA;3466;1933;80;0
Song Hong Garment JSC - Factory 15.16.17.18;FINISHED GOODS;Apparel;Nike;;SONG HONG;Nghia Thai Industrial Zone Nghia Hung District;Nam Dinh/ Nam Dinh;Nam Ðnh;420000;Vietnam;SE ASIA;2020;1600;80;0
Song Lin Garment Sdn Bhd;FINISHED GOODS;Apparel;Nike;;RAMATEX;Lot 2552;Batu Pahat;Johor;83000;Malaysia;S ASIA;925;917;42;91
SongSen Garment Suzhou Ltd;FINISHED GOODS;Apparel;Nike;;RAMATEX;168 Liu Feng Road;Suzhou;Jiangsu;215124;China;N ASIA;619;585;80;0
South Island Garment Sdn. Bhd.;FINISHED GOODS;Apparel;Nike;Collegiate;SOUTH ISLAND;2468 Solok Perusahaan Dua;Perai;Pulau Pinang;13600;Malaysia;S ASIA;549;293;53;64
Southern Apparel Contractors S.A. The Arena;FINISHED GOODS;Apparel;Nike;;TEGRA;San Pedro Sula;San Pedro Sula;Cortés;1110;Honduras;AMERICAS;1438;1200;54;1
Sportek;FINISHED GOODS;Footwear;Nike;;DIAMANT;Milosa Oblica;Kotor Varos;Republika Srpska;78220;Bosnia;EMEA;1998;1835;71;0
STANWELL-EXPAN CO. LTD;FINISHED GOODS - COMPONENTS;Apparel;Nike;;STANWELL-EXPAN;No 8 Dinghu 9th St Gueishan;Taoyuan;Taoyuan;333;Taiwan;N ASIA;289;147;48;7
