Title,Place,Job_type,Department,Date,Overall_rating,work_life_balance,skill_development,salary_and_benefits,job_security,career_growth,work_satisfaction,Likes,Dislikes
Senior Costing Manager,Noida,Full Time,Engineering & Manufacturing Department,0 Jul 2023,4.0,3.0,5.0,5.0,3.0,2.0,4.0,"For Learing HAIER Is best and Best organization, You will good in Advance Excels, PPT meetings with Top Management, Working standards and Criteria. How Top MNC'S actually work. If you get a chance to learn a part of Costing...It's wonderful learning Skils","Chinese and Indian huge Pressure, No one will Support you, you have to fight alone even your Boss Also. Work Indivisual on your own risk. Chinese does not help you they only need the Targets, Office Politics, very Bad working culture. 
Once you can work in this culture you can survive in any other Industries easily.
""Kacche and Kamjor Dil vale HAIER Join Na Kre"""
Assistant Engineer,"Greater Noida, Uttar Pradesh",Full Time,"Operations, Maintenance & Support Department",9 Jul 2023,1.0,1.0,1.0,2.0,4.0,1.0,1.0,"HR person  work is so good. canteen area in clean, ac bus free, No any salary deduction for any secondary issue. Safety is very good. medical facilities available in the company.","Work life unbalance, manager's behaviour not good as Lala chhap, No pramotion, pramotion according Lala chhap, manager's don't have leadership qualities. not good company for contractual base person, and good for till assistant engineer in. Any department at this upper level salary and work life balance is good."
Branch Manager,Pune,Full Time,Marketing Department,2 Sep 2023,1.0,1.0,1.0,1.0,1.0,1.0,1.0,Please don't work in this company there is no any discipline and culture. You will spoil your personal life. There is no any job security.,"Religion and cast base manpower appointment.
 Very bad culture,no any discipline, lowest salary structure in the industry"
In Shop Demonstration,"Lakhimpur, Uttar Pradesh",Full Time,Enterprise & B2B Sales Department,5 Jul 2023,5.0,5.0,5.0,5.0,5.0,5.0,1.0,Hi sir/ma'am my self Rahul verma . I am 6 year old isd for Haier India pvt ltd. Best achievement 5 years top profomance all North 2 RRC UP . But not a promote for up country isd .why . Then ans me .,Haier company is very good product manufacturing. But sarvice center is very poor bad behaviour and customer is very haigper. Risk for isd sellout .
Senior Quality Engineer,"Pune, Maharashtra",Full Time,Quality Assurance and Testing Department,0 May 2023,1.0,1.0,1.0,1.0,1.0,1.0,1.0,I'm not satisfy here,"A company with a combination of Poor work life balance, dirty politics, highest favoritism and pathetic working culture. You can have altogether here.
You'll be advised to work like a donkey in working and do your documentation work after going home.
Abusive language is a common term here, if you don't shout you'll be considered as a non performing asset.
They'll hire you by giving you 2-3 positions hike but trust me it hardly creates any difference. You won't be able to justify a package of 5.5LPA at a position of Dy. Manager.
Good point is you can enhance your presentation skills here if you're in REF Factory.
My clear advice is to you is don't spend much time here because though it sounds like a OEM but in actual it us way poor than a vendor company.
People here are pressured and forced to a level where they've to leave job without having another job in hand.
Can't recommend to anyone, yes if you're jobless right now you can go for it.
But don't fall in the trap....Read More"
Sales Executive,"Haridwar, Uttarakhand",Full Time,Sales Support & Operations Department,6 Jun 2023,5.0,5.0,4.0,3.0,4.0,4.0,5.0,"Haier has established an excellent reputation for home electronic appliances, including refrigerators. They offer various options, keeping in mind the needs and requirements of the customers. Their refrigerators are multi-functional and budget-friendly.",Company does not increase salary
Rso,"Kolhapur, Maharashtra",Full Time,Sales Support & Operations Department,7 Aug 2023,5.0,5.0,4.0,5.0,5.0,5.0,5.0,Company and product is too good,Company is good but traveling expenses not provide as per traveling expenses company giving 6000 fixed but whole District traveling expenses goes to above 11k so I will take resign because every month traveling cost cutting my pocket
Officer,Greater Noida,Full Time,Stores & Material Management Department,6 Sep 2023,5.0,4.0,3.0,4.0,4.0,4.0,3.0,"Great work palace and more opportunities for enhancing your skills ,","Promotion and increment not good, mostly staff relationship with other staff, Nepotism"
Logistics Manager,Greater Noida,Full Time,SCM & Logistics Department,4 Aug 2023,4.0,3.0,3.0,4.0,2.0,3.0,4.0,"Salary is really good. Openness , you can touch all verticals and not limited to just your profile.",Office is right at the end of Greater Noida. Long travel time & SOP's missing.
Apprentice Trainee,"Shirur, Maharashtra",Full Time,Engineering Department,7 Sep 2023,5.0,5.0,5.0,5.0,5.0,5.0,5.0,"Very nice company. Hr policy very good. all facilities available. Pemet very good. Management,staft are good.",Very nice company never Dislikes.
Electrical Maintenance Engineer,New Delhi,Full Time,"Operations, Maintenance & Support Department",7 May 2023,4.0,4.0,4.0,4.0,4.0,4.0,4.0,Haier india ia a 100 percent subsidiary of haier group. a fast growing consumer durables company. Haier is also the world's no 1 brand in refrigeration appliances.,"Company and management is good and home appliances product and service refrigerator also good, required service engineer training other wise company is very good"
Production Manager,Pune,Full Time,Production Department,6 Aug 2023,3.0,2.0,3.0,3.0,2.0,2.0,1.0,"On time salary, adhearance on policy","Negligible annual salary rise, heavy work pressure, illogical demand from management."
Deputy Manager,Greater Noida,Full Time,"Operations, Maintenance & Support Department",3 Sep 2023,3.0,1.0,2.0,3.0,4.0,3.0,2.0,"Job security, salary on time, some seniors are very supportive, transportation, monthly awards","Work Life balance, 24x7 type working, late sitting,some HOD had no vision about there department, SOI department ,as this department has no work in company only gathering data and deduct the salary of employees, less increament, No JD , Most of the HODs are Dummy and passing the time there. Unnecessary shouting"
Site Supervisor   (working remotely),,Full Time,Refrigerator Cabinet foaming  Department,4 Aug 2023,5.0,5.0,5.0,5.0,5.0,5.0,5.0,Haier appliances is good company my skills very improve & work confidence,Haier appliances company that good if manpower skills developed
Qms Quality Engineer   (working remotely),,Full Time,Other Department,3 Aug 2023,5.0,5.0,5.0,5.0,5.0,5.0,5.0,Customer satisfaction on time delivery focus on the process,Can't tolerate the loss of the company
Quality Engineer,Greater Noida,Full Time,Production & Manufacturing Department,3 Sep 2023,5.0,5.0,5.0,5.0,5.0,5.0,5.0,Yes best company of haier.,Yes   good knowledge of haier company.
Sales Consultant,Surat,Full Time,Category Management & Operations Department,0 Jul 2023,5.0,5.0,5.0,5.0,5.0,5.0,4.0,"Freedom work facilities 
And no work pressure",Market and other composition brand provide HAIER marketing level poor
Manager Accounts And Internal Control,Greater Noida,Full Time,Finance Department,9 Jun 2023,2.0,4.0,1.0,3.0,3.0,2.0,1.0,"Office closes at 5:30 sharp, gym and sport facilities available can access after ofc hours","Culture 
No opportunity to learn and try new things to grow
PBC salary structure"
Quality Inspector,Noida,Full Time,"Operations, Maintenance & Support Department",5 Jul 2023,5.0,4.0,5.0,3.0,4.0,3.0,3.0,All things is good and also the environment and senior are friendly with employees.,The security staff is not so good.
Sales Manager,New Delhi,Full Time,Retail & B2C Sales Department,6 Sep 2023,3.0,5.0,2.0,3.0,5.0,4.0,3.0,Work life balance,No discussion at Branch level
Branch Logistics Manager,"Raipur, Chhattisgarh",Full Time,SCM & Logistics Department,3 Sep 2023,4.0,4.0,4.0,4.0,4.0,4.0,4.0,Good place to work.,Need to work addyional time
Brezzing,"Mumbai, Maharashtra",Part Time,Brezzing Department,0 Sep 2023,3.0,2.0,2.0,2.0,2.0,1.0,1.0,Salary is not very good and this giving break 1 year,Not yeam
Regional Sales Officer,Pune,Full Time,Retail & B2C Sales Department,8 Sep 2023,5.0,5.0,5.0,5.0,4.0,5.0,5.0,Led market retailer and parimary distribution handling he team,Nothing one
Assistant Manager,Pune,Full Time,Production & Manufacturing Department,4 Jun 2023,5.0,5.0,5.0,5.0,5.0,5.0,5.0,This is the best organization for new learning and carrier growth. I learned so much thing with the help all top management support.,No
Dsc Manager,"Mehsana, Gujarat",Full Time,After Sales Service & Repair Department,7 Sep 2023,5.0,4.0,4.0,5.0,5.0,5.0,5.0,supportive & helping in nature,difficult to manage work life
Qa Qc Inspector,Greater Noida,Full Time,Quality Assurance and Testing Department,5 Aug 2023,4.0,4.0,4.0,3.0,3.0,4.0,3.0,"Nice looking, wonderful facilities",Miss behaviour
Functional Consultant,Vijayawada,Full Time,Finance Department,3 Jun 2023,2.0,2.0,1.0,2.0,3.0,3.0,1.0,Good for sakes employees only,"Less women employees other than sales No recognization for depts
No growth for off role employess"
Assitant General Manager- QA,Pune,Full Time,Production & Manufacturing Department,0 Jun 2023,2.0,2.0,1.0,2.0,1.0,2.0,2.0,Being a MNC people knows where your person working,At first Haier shows EMC part of salary then they uses to calculate as per their understanding & calculations. Later you will realise that you beaver had get that amount which was mentioned in your offered letter.
Store Executive,Greater Noida,Full Time,Stores & Material Management Department,6 Aug 2023,5.0,5.0,5.0,5.0,5.0,5.0,5.0,Good timing and working culture,Not to dislike
Hospital Administrator   (working remotely),,Part Time,General Insurance Department,4 Jun 2023,1.0,5.0,2.0,5.0,4.0,1.0,3.0,I am like to working for hair customer care support is very good and work is nice and very simple and enjoying to,What's this like system message Abhi Tak Nahi Jaan Paye Hain
Deputy Manager,"Greater Noida, Uttar Pradesh",Full Time,"Operations, Maintenance & Support Department",4 Jul 2023,4.0,4.0,3.0,3.0,3.0,3.0,3.0,"Good learning,  good area of learing scope",Very less financial growth
Assistant Engineer,Pune,Full Time,Production & Manufacturing Department,1 Aug 2023,5.0,4.0,5.0,4.0,3.0,4.0,4.0,"Team work 
 product totaly qualification","Bad activities  one-one man work 
people behaviot"
Service Engineer,GAUHATI,Contractual,After Sales Service & Repair Department,9 Aug 2023,5.0,5.0,5.0,4.0,5.0,5.0,4.0,For my better performance in future,About service center for less performance in field
Manager,"Chandigarh, Chandigarh",Full Time,Sales Support & Operations Department,2 Aug 2023,5.0,4.0,5.0,5.0,1.0,2.0,3.0,YES Haier is professional organization,Process are not clear.
Product Manager,"Mumbai, Maharashtra",Full Time,Retail & B2C Sales Department,9 May 2023,5.0,5.0,5.0,5.0,5.0,5.0,5.0,"Very professional company to work & upgrade ourself with lots of support from senior managers. 
Over all enjoy working here 😃",Not so far
Sales Executive,Chennai,Full Time,Employee Relations Department,3 May 2023,5.0,4.0,4.0,4.0,4.0,3.0,3.0,HAIER COMPANY WAS GOOD QUALITY  OF COMPANY.BUT SERVICE WAS AVERAGE...IF U GET GOOD SERVICE PROVIDE AND THEN NO 1 COMPANY IMPROVING...,"SERVICE IS POOR,"
Senior Executive Store,Pune,Full Time,Stores & Material Management Department,1 Jul 2023,2.0,1.0,4.0,1.0,2.0,1.0,2.0,Nothing to like,"Poor management, and daily extra working"
Housekeeping Supervisor   (working remotely),,Full Time,Facility Management Department,7 Aug 2023,4.0,4.0,4.0,4.0,4.0,4.0,4.0,Treating everyone as equal priority over here.,Overall good experience no dislikes
Diploma Engineer Trainee,Pune,Full Time,Production Department,2 Sep 2023,5.0,5.0,5.0,5.0,5.0,5.0,5.0,Best working idea how to work in work shop,Best work
Computer Operator   (working remotely),,Freelancer,General Insurance Department,0 Jul 2023,5.0,5.0,5.0,5.0,5.0,5.0,5.0,"Ksnksksnslsmla
Jsikslowlw
Kwokwskosksksn
Jsksnsksm
Ejksjsk2
Jjsnsks
Isjsjks
Ososksk",Nothing
Junior Engineer,Pune,Full Time,Production & Manufacturing Department,7 Sep 2023,5.0,5.0,4.0,5.0,5.0,3.0,4.0,Thats a good company,Not
Area Service Manager,"Surat, Gujarat",Full Time,Customer Success Department,8 Jun 2023,4.0,4.0,4.0,4.0,4.0,4.0,3.0,Skill Development and variable benefits,Promotional / Appraisals are too low
Senior Engineer,Greater Noida,Full Time,Production & Manufacturing Department,8 Jun 2023,4.0,4.0,4.0,4.0,4.0,4.0,4.0,Working culture is set by Chinese is good,Management person also to be review every year for compatibility
Sr. Engineer-SCM,Pune,Full Time,SCM & Logistics Department,4 Aug 2023,4.0,3.0,4.0,4.0,3.0,3.0,4.0,System based systematic work.,Documentation part
Deputy Manager,Greater Noida,Full Time,Quality Assurance and Testing Department,7 Jul 2023,1.0,1.0,3.0,3.0,4.0,1.0,2.0,You will learning about you technology,"Mentally harrassment
Working life very poor"
Trainee,Greater Noida,Full Time,Product Management - Technology Department,1 Sep 2023,4.0,4.0,4.0,4.0,4.0,4.0,4.0,Everything on time,Nothing for dislike
Senior Officer,Greater Noida,Full Time,"Operations, Maintenance & Support Department",3 Jul 2023,2.0,2.0,3.0,3.0,3.0,3.0,2.0,Very poor SOP and mangement politics.,Very bad culture.. Not secure life balance
Sales Promoter   (working remotely),,Part Time,Sales Support & Operations Department,2 Sep 2023,5.0,5.0,5.0,5.0,5.0,5.0,5.0,Good product $ services,Nil
Packing Operator,Pune,Full Time,"Operations, Maintenance & Support Department",7 Aug 2023,5.0,5.0,5.0,5.0,5.0,5.0,5.0,Very nice work it department,Canteen worker is very bad I dislike it
Senior Service Engineer,Ullubari Guwahati Assam,Full Time,"BFSI, Investments & Trading Department",7 Jun 2023,4.0,4.0,5.0,4.0,3.0,4.0,4.0,Overall good company and to inhance more knowledge with more products..  inrespect of good work culture,No dislike
Robot Operator,Noida,Full Time,Other Department,6 Jul 2023,4.0,3.0,3.0,3.0,1.0,4.0,1.0,The quality of it prodects is good. I like it.,In this company salary is not enough.
Assistant Manager Strategy Operations,Greater Noida,Full Time,Strategic Management Department,8 Jul 2023,5.0,5.0,5.0,5.0,5.0,5.0,5.0,"1. Excellent work culture
2. Support from senior management",1. Distance
Assistant Engineer,Pune,Full Time,Production & Manufacturing Department,6 Aug 2023,5.0,5.0,5.0,5.0,5.0,5.0,5.0,Good  work,Team work not ok
Production Supervisor,New Delhi,Full Time,Engineering Department,0 Aug 2023,3.0,3.0,3.0,3.0,3.0,3.0,3.0,work satisfaction are very good,company culture are very bad
Manager - Moder Trade,"Hyderabad/Secunderabad, Telangana",Full Time,Retail & B2C Sales Department,6 Jul 2023,4.0,4.0,4.0,5.0,4.0,5.0,4.0,Culture & Employee Oriented Policies,6 days Working
Senior Lab Engineer   (working remotely),,Full Time,Quality Assurance and Testing Department,3 May 2023,5.0,5.0,5.0,5.0,5.0,5.0,4.0,Very Good Company Culture senior are very supportive,Haier Reduced production but never compromise with quality
Senior Consultant,"Greater Noida, Uttar Pradesh",Full Time,Sales Support & Operations Department,1 May 2023,5.0,3.0,5.0,3.0,5.0,5.0,3.0,Company give all the freedom to achieve your traget,As compared to same organisation salary are bit lower
Senior Manager Strategy,New Delhi,Full Time,Strategic Management Department,3 Aug 2023,3.0,4.0,2.0,4.0,3.0,4.0,3.0,Good place to work,Opportunity to grow overall good
Quality Inspector,Greater Noida,Full Time,Quality Assurance and Testing Department,2 Jul 2023,5.0,5.0,5.0,5.0,5.0,5.0,5.0,Everything,Nothing ( I like everything to working here)
Director - Airconditioner Business,"Greater Noida, Uttar Pradesh",Full Time,Top Management Department,3 Jun 2023,4.0,4.0,3.0,3.0,4.0,4.0,3.0,Growing young company more to learn more to explore. Open to creativity.,Little less in salary n perks
Assistant Manager,Pune,Part Time,"Operations, Maintenance & Support Department",5 Jun 2023,4.0,4.0,4.0,5.0,3.0,4.0,3.0,Working culture and documentation system is good.,Every thing is ok.
Operator,"Greater Noida, Uttar Pradesh",Full Time,Production Department,6 Sep 2023,5.0,5.0,5.0,5.0,5.0,5.0,5.0,Good job haier company,Dislike not Reagan
Line Leader,Greater Noida,Full Time,"Operations, Maintenance & Support Department",6 Jul 2023,4.0,4.0,3.0,4.0,3.0,3.0,3.0,Bas treatment of my life,Manejment and system
Manager Hr Operations,New Delhi,Full Time,HR Operations Department,7 Aug 2023,5.0,5.0,5.0,5.0,5.0,5.0,5.0,Employee Benefits and Learning Scope,Nothing
Manager,Noida,Full Time,Production Department,3 Sep 2023,4.0,3.0,3.0,3.0,4.0,2.0,3.0,overall ok.,depends on requirements
Research And Development Officer,Greater Noida,Full Time,Engineering & Manufacturing Department,9 Jun 2023,5.0,5.0,4.0,4.0,4.0,4.0,4.0,Working environment  is very friendly..,Taking  to time for do permanent in job...
Branch Service Manager,"Coimbatore, Tamil Nadu",Full Time,After Sales Service & Repair Department,9 Aug 2023,4.0,4.0,3.0,5.0,2.0,3.0,3.0,Yes,No proper support for new joiner and no time given to show there improvement
Assistant Manager Operations,Greater Noida,Full Time,Finance Department,3 Jul 2023,4.0,5.0,3.0,4.0,3.0,3.0,2.0,Nice work culture and good company,Job security is not good
Deputy Manager Quality Assurance,Greater Noida,Full Time,Operations Support Department,9 Jun 2023,5.0,5.0,5.0,5.0,5.0,5.0,5.0,Work culture is so good,Over staying and unplanned plan is much more
Quality Inspector,Greater Noida,Contractual,Quality  Department,3 Jul 2023,5.0,5.0,5.0,5.0,5.0,5.0,5.0,Nice Culture,There is no shortage in working Haier company is very big
Ui Developer,Pune,Full Time,UI / UX Department,3 Aug 2023,5.0,5.0,5.0,5.0,5.0,5.0,5.0,Leave policy good,Salary very low
Hair Faculty   (working remotely),,Part Time,Beauty & Personal Care Department,0 Jul 2023,1.0,1.0,1.0,1.0,1.0,1.0,1.0,I like it bcz it's about to look beautiful hair,nothing
Manager,Delhi NCR,Full Time,After Sales Service & Repair Department,5 Jul 2023,5.0,5.0,5.0,5.0,5.0,5.0,5.0,Fabulous,"Not found yet.
All well"
Senior Engineer,Pune,Full Time,Engineering & Manufacturing Department,1 Sep 2023,3.0,3.0,3.0,3.0,3.0,3.0,3.0,Learning will be great,Uncertainty of work.
Regional Sales Officer,"Patna, Bihar",Full Time,Enterprise & B2B Sales Department,7 May 2023,4.0,4.0,5.0,3.0,4.0,4.0,3.0,Working Culture & Overall Average..,"Salary package,Salary increment & Promotion is not good."
Credit Controller,"Surat, Gujarat",Full Time,Finance Department,5 May 2023,3.0,3.0,2.0,3.0,3.0,2.0,3.0,Superior support is very strong,Company culture & office timing not suitable
Senior Engineer,Greater Noida,Full Time,Production Department,4 Jul 2023,5.0,5.0,5.0,5.0,5.0,5.0,5.0,Haier is very nice work station for startup.,Nothing all cultures are good
Shift Manager,Pune,Contractual,"Operations, Maintenance & Support Department",4 Aug 2023,4.0,4.0,3.0,4.0,4.0,3.0,4.0,Good career opportunities,Less learning opportunities
Executive Accountant,Greater Noida,Full Time,Back Office Department,0 Jan 2023,1.0,1.0,1.0,3.0,2.0,1.0,1.0,No need skills if you have reference of Haier Top Management or your relative is working there. So please go for interview through reference and spend your dream honeymoon period at work place.,If you are hardworking so this place not for you. Don't waste your time and energy.
Warehouse Executive,New Delhi,Full Time,Spare part Department,4 Jul 2023,4.0,3.0,4.0,4.0,4.0,3.0,4.0,A lot to learn,Timing issues
Operations Manager- BI,Greater Noida,Full Time,Sales Support & Operations Department,4 Jun 2023,2.0,1.0,1.0,2.0,3.0,1.0,3.0,Nothing,"Work life culture, no learning, no automation and technology"
Production Engineer,New Delhi,Full Time,Operations / Strategy Department,6 Jun 2023,5.0,5.0,5.0,5.0,5.0,5.0,5.0,good company  lot of good things to learn,no any dislikes everything is good
Diploma Mechanical Engineer,Greater Noida,Full Time,Quality Assurance and Testing Department,1 Sep 2023,4.0,4.0,4.0,5.0,4.0,5.0,3.0,Inward material testing and fitment  trail fit on running line and go head warehouse as per customer demand requirements.,Complete one training employee after contract option.
Branch Service Manager,"Bhubaneswar, Odisha",Full Time,After Sales Service & Repair Department,6 Jul 2023,5.0,5.0,5.0,5.0,5.0,5.0,5.0,Every thing is good,Nothing
Diploma Engineer Trainee,Greater Noida,Full Time,Quality Assurance and Testing Department,6 Jun 2023,5.0,5.0,5.0,5.0,5.0,5.0,5.0,Yes I'm interested job to Haier Appliances,I'm no  dislike Haier Appliances
Manager IT,New Delhi,Full Time,IT Network Department,6 Jul 2023,3.0,3.0,3.0,2.0,2.0,3.0,2.0,All good,Nothing to say any thing
Deputy Manager,Greater Noida,Full Time,Sales Support & Operations Department,7 Jun 2023,3.0,4.0,1.0,2.0,4.0,3.0,3.0,"Good meal and transport, less pressure,","bad kpi system, no training, illogical admin team, no system of referrals"
Scm Engineer,Pune,Full Time,Stores & Material Management Department,4 Aug 2023,4.0,3.0,3.0,3.0,5.0,3.0,3.0,Supportive team mates,No any Dislikes
Telecaller   (working remotely),,Full Time,BD / Pre Sales Department,3 Aug 2023,3.0,1.0,3.0,3.0,3.0,3.0,3.0,Yes  I like,No dislike
Sub Staff,Noida,Full Time,"Operations, Maintenance & Support Department",6 Jun 2023,4.0,4.0,4.0,4.0,4.0,5.0,4.0,This company culture was very good.,Housekeeping system is not good.
Deputy Product Manager,"Kochi, Kerala",Full Time,BD / Pre Sales Department,0 Mar 2023,3.0,2.0,3.0,4.0,3.0,2.0,4.0,"Hike depending on previous salary. Travel reimbursements in form of TA/DA satisfactory
Incentives eligible on 70% achievement of monthly targets","Immense sales pressure that will take a toll on your personal life
In addition to monthly and yearly targets, there is sales closing on every Thursday to add to your woes
Absolutely no room for thinking outside the box as you will be on your toes to achieve daily committed target regardless of whether you have achieved your monthly targets
Too much micromanagement with consistent and daily video conferences that will grill you regardless of your performance
Too much attrition which company does not care as new scapegoats will arrive attracted to the compensation
Do not expect any help from any department or person in the company unless its part of their KRA , you are left to fend for yourself from day 1 as you struggle with paperwork and documentation, company laptop, attendance portal, dealer visit marking portal etc 
On top of all this its 6 day working with only a Sunday for you to find time for your personal life, that too forget it if month end is near...Read More"
2 Year,Greater Noida,Freelancer,Product Management - Technology Department,9 Apr 2023,5.0,5.0,5.0,5.0,5.0,5.0,5.0,How much do I like airplanes because while working in Hierappa I do not get any kind of,work in airplane that i faced any such problem
Assistant General Manager- Supply Chain Service,Greater Noida,Full Time,Service Delivery Department,2 Apr 2023,5.0,4.0,3.0,5.0,5.0,4.0,5.0,"Fast growing sales
Quick decision making
High growth rate if your are talented","Salary structure
Very less skill development opportunity"
Rso,"Kolhapur, Maharashtra",Full Time,Enterprise & B2B Sales Department,9 Aug 2023,5.0,5.0,5.0,5.0,5.0,5.0,5.0,Veery must in home appliances product,No
Area Service Manager,Pune,Full Time,After Sales Service & Repair Department,7 Aug 2023,5.0,5.0,5.0,5.0,5.0,5.0,5.0,Active service supprt,No any
Dy Mana,"Noida, Uttar Pradesh",Full Time,Finance Department,4 Jul 2023,4.0,4.0,5.0,5.0,5.0,5.0,5.0,"Learning 
Salary hike 
Supportive finance staff",Time Management
Production Officer,Greater Noida,Full Time,Product Management - Technology Department,9 Apr 2023,5.0,2.0,1.0,2.0,2.0,1.0,1.0,"Good for work ,company is very good but management has no clear policies","Not clear policies , not proper trainings"
Sr. Engineer,Greater Noida,Contractual,Engineering Department,3 Jun 2023,3.0,2.0,3.0,4.0,2.0,3.0,5.0,Nothing to like in company,Many points need to be improved
Sr.quality Assurance Engineer,Pune,Full Time,Quality Assurance and Testing Department,3 Jul 2023,4.0,4.0,4.0,4.0,3.0,3.0,4.0,Good place to growth.,Politics
Assistant Manager-IQC,Greater Noida,Full Time,Production & Manufacturing Department,5 Aug 2023,2.0,3.0,2.0,2.0,3.0,2.0,2.0,Nothing to like,Bad politics.
Branch Service Manager,"Rajkot, Gujarat",Full Time,Service Delivery Department,9 Feb 2023,5.0,3.0,5.0,5.0,5.0,4.0,5.0,"Really appreciate micro enterprises culture,. Do more earn more !! In all the level,. Including ground field team and frontlines !!","Nothing to mention in this Category,. All Good"
Associate Director,Greater Noida,Full Time,Sales Support & Operations Department,5 Jul 2023,5.0,5.0,5.0,5.0,5.0,5.0,5.0,Everything,None to dislike Haier Appliances
Commercial Assistance,Vijaynagar Indore,Full Time,Finance Department,4 May 2023,5.0,5.0,4.0,3.0,3.0,5.0,3.0,Every thing is good,"Not value a hard , honest,panchual worker I have worked 5 year but still working as a off roll employee no chance on roll"
Gat Production,Pune,Full Time,Production & Manufacturing Department,3 Aug 2023,5.0,5.0,5.0,5.0,5.0,5.0,5.0,This is a good campany,All good in this campany
Inshop Demonstrator,"Ambala, Haryana",Full Time,Retail & B2C Sales Department,1 Jun 2023,3.0,3.0,4.0,4.0,3.0,4.0,3.0,Overall experience was ok ok,Work life balance
Customer Care Officer,"Haridwar, Uttarakhand",Full Time,Cco Department,3 Aug 2023,5.0,5.0,5.0,5.0,5.0,1.0,5.0,He is always helping to customer,Will update later. Right now I can not review.
Deputy Manager Operations,Greater Noida,Full Time,"Operations, Maintenance & Support Department",1 May 2023,3.0,2.0,2.0,3.0,3.0,3.0,3.0,Have a lot of things but will update later.,not much
