Title,Place,Job_type,Department,Date,Overall_rating,work_life_balance,skill_development,salary_and_benefits,job_security,career_growth,work_satisfaction,Likes,Dislikes
Area Service Manager,,,Construction Engineering Department,7 Sep 2019,5.0,5.0,5.0,5.0,4.0,4.0,4.0,Old timer boss. Never work with Mr Triveni.,Bad boss
Regional Training Manager,Chennai,,Corporate Training Department,5 Dec 2018,1.0,5.0,5.0,5.0,4.0,4.0,4.0,,
,,,,,,1.0,1.0,1.0,1.0,1.0,1.0,,
Sales Executive,ICHALKARANJI,Full Time,Sales  Department,0 Mar 2019,5.0,5.0,5.0,5.0,5.0,5.0,5.0,Goods salery  /yes,Yes
Service Trainer,Kolkata,Full Time,,3 Oct 2018,4.0,4.0,5.0,4.0,5.0,5.0,4.0,Organisation is employee friendly and always think for employees.,No such dislikes
Billing Executive,Chennai,Full Time,SCM & Logistics Department,8 Dec 2018,5.0,4.0,4.0,4.0,5.0,3.0,3.0,Good,Everything is good but some politics happening
Jr. Officer Audit Mobility,Gurgaon,,Compliance  Department,9 Feb 2019,4.0,5.0,4.0,4.0,4.0,4.0,4.0,"The company is open to new ideas , any feedback given is accepted and implemented.",Nothing as such
Team Leader,Delhi,,,5 Nov 2019,1.0,1.0,1.0,1.0,1.0,1.0,1.0,Nothing...,Basically lots of politics..
Trade Marketing Coordinator,Surat,,Marketing Department,9 Dec 2018,1.0,1.0,4.0,1.0,1.0,1.0,1.0,No job Security,No job Security
Deputy Manager -finance,"Gurgaon/Gurugram, Haryana",,,3 Dec 2022,4.0,4.0,4.0,4.0,4.0,4.0,4.0,Working condition,Some of people
BRANCH CUSTOMER CARE HEAD,Bhubaneswar,,Non Voice Department,7 Dec 2018,5.0,4.0,5.0,5.0,5.0,5.0,5.0,"Very good learning opportunities,good culture",Nothing now
Quality Analyst,Jahjjar,,Quality Department,5 Dec 2018,4.0,5.0,5.0,4.0,5.0,4.0,5.0,I am fine and good fill,Contrual  man power not pay role
Service Engineer,Doha- Qatar,,Software Development Department,8 Feb 2018,4.0,4.0,4.0,4.0,4.0,5.0,4.0,"Nice environment to work in NAS Panasonic.
Salary is also Good.",Career growth is limited
Assistant Sales Manager,Pune,Full Time,BD / Pre Sales Department,5 May 2018,1.0,1.0,1.0,1.0,1.0,1.0,1.0,Not hood for career development and for job satisfaction.  It's very bad Organisation as handling by very bad people.,Working culture is very pathetic and bad.  No santity and logic from upper people.  Endless....
Sales,Durgapur,,,8 Aug 2020,4.0,5.0,5.0,4.0,5.0,5.0,3.0,Good work environment and Superior are really supportive,There is no option to promote from junior sale officer to Next level
Seles Executive,Mumbai,,home application  Department,8 Aug 2017,4.0,3.0,4.0,3.0,2.0,3.0,1.0,Its perceived as a good brand,"Work culture, monotony, one man show"
Deputy Manager,Gurgaon,,Marketing Department,2 Aug 2018,3.0,1.0,2.0,1.0,4.0,2.0,2.0,"Healthy work environment, worked lyk a family to accomplish the goals. Had a great experience,good coordination,got to learn many things,employees hlpful nd guiding nature hlpd me",There is nothing negative about the company. But there was more workload. But i got appreciated always
Back Office Executive,Delhi,,HR Operations Department,5 Jun 2018,5.0,5.0,4.0,5.0,4.0,5.0,5.0,"I am a part of team that markets reliable high_quality products and has a global client  base .As a result, i get to travel abroad especially to that us and canada .but on  site travel is completely dependant  on your project and client's  location mine is a us based clinet and they have some offices in Toronto hence i got",Compensation is decent .but growth is slow
Asm,Bellary,,,1 Apr 2018,5.0,4.0,5.0,5.0,5.0,5.0,5.0,Its great experience with Panasonic with Panasonic,Nice appraisal
Sales Executive,Nagpur Bajaj Nagar,,Retail & B2C Sales Department,0 Oct 2018,5.0,4.0,5.0,4.0,3.0,4.0,4.0,Teammates,Work
Relationship Manager,Chennai,,Marketing Department,0 Dec 2019,5.0,4.0,5.0,5.0,1.0,4.0,4.0,Everything good company to work,Nothing everything is going well
Sales,"Nagpur, Maharashtra",,,5 Sep 2022,5.0,5.0,5.0,5.0,5.0,5.0,5.0,Nothing is good to work there,Nothing to like there
Sales Analyst.,Guragaon,,BD / Pre Sales Department,2 Apr 2019,1.0,1.0,2.0,2.0,1.0,1.0,1.0,,
Promoter,Kumbakonam,Full Time,"Operations, Maintenance & Support Department",1 May 2021,5.0,4.0,4.0,4.0,5.0,5.0,5.0,"Interest , work satisfaction,coordination team members,supportive for improve my knowledge,job securuty and compAny policies",Nil
Sales Executive,Beagumpet,,Hyderabad Department,6 Dec 2018,5.0,5.0,5.0,4.0,5.0,4.0,5.0,Simply goog,No Dislikes
Sales Manager,Thane,,Sales Department,2 Nov 2018,5.0,5.0,5.0,5.0,5.0,5.0,5.0,It's all good,It's all good
Branch Commercial Executive Or Accounts Receivable Executive,Gurgram,,Accounts Department,7 Nov 2018,2.0,1.0,1.0,1.0,1.0,1.0,1.0,Never join on third party payroll.,Never join on third party payroll
Deputymanager,Mumbai,,BD / Pre Sales Department,1 Oct 2018,5.0,5.0,5.0,5.0,5.0,5.0,5.0,"Quality products, Completely taking care of employees",No
Warehouse Manager,Ranchi,,SCM & Logistics Department,4 May 2018,5.0,4.0,4.0,4.0,4.0,4.0,4.0,"I love the fact that I am a part of a team that markets reliable,high quality products.another plus point is that my colleague come from various cultural background and we work happily in collaboration","Growth is very slow, the work pressure is very high sometimes,I have to work 12-14 hours."
Branch Team Leader-Sales,Ludhiana,,Market/Training/Sales Department,3 Feb 2018,3.0,3.0,3.0,3.0,3.0,3.0,3.0,The company is open to innovation and readily adopts latest technology. I love the fact that i am a part of a team that markets reliable.,"Compensation is decent,but growth is slow. The work pressure is very high. Managers do no value an individual's unique strengths, which is why i have take back my suggestions most of the times. Need system improvements as compared to other competition brands in market."
Fieldwork Technician,Adajan,,Technician  Department,9 Dec 2019,5.0,2.0,3.0,2.0,2.0,3.0,2.0,"Training ,office and environment",Late salary
AC OPRAITER,Delhi NCR,,AC Department,6 Aug 2019,5.0,5.0,5.0,5.0,5.0,5.0,5.0,Good Company to work with..,None
Senior Engineer Production Aircon And Washing,Jhajjar,,Manufacturing Department,2 Dec 2018,4.0,5.0,5.0,5.0,5.0,5.0,5.0,,
,,,,,,5.0,4.0,4.0,5.0,5.0,4.0,,
BCC And Finance And Account,Aurangabad,,Accounts and Finance  Department,8 Dec 2018,4.0,4.0,4.0,4.0,2.0,5.0,4.0,Work environment is good,Everything is good
Store Manager,New Delhi,,SCM & Logistics Department,1 Oct 2018,4.0,4.0,4.0,3.0,1.0,3.0,2.0,"Over all good.
There is nothing to much good or bad.",Over all good.
Senior Executive,Gurgaon,,Quality Assurance and Testing Department,5 Jun 2018,3.0,3.0,2.0,3.0,2.0,2.0,3.0,"1. Cultural activities are plus point to keep the team motivated.
2. Quarterly parties + a trip.",No job security
Sales Executive,Moradabad,,Retail & B2C Sales Department,3 Aug 2018,4.0,4.0,5.0,5.0,4.0,5.0,4.0,I like my senior behaviour,No designation changed
It Consultant,Singapore,,Technology / IT Department,6 Apr 2019,4.0,3.0,3.0,3.0,4.0,2.0,3.0,Good place to work,Management was poor
Assistant Manager,Gurgaon,,R&D Department,6 Mar 2019,5.0,5.0,4.0,4.0,4.0,4.0,4.0,Travel,Work Environment
Area Service Manager,Patna,,Voice / Blended Department,8 Feb 2019,2.0,5.0,4.0,4.0,4.0,4.0,4.0,Compensation,"No family life, Job security, politics, bad work environment"
Deputy Manager Logistics,Gurgaon,,,3 Aug 2018,2.0,1.0,4.0,3.0,2.0,2.0,3.0,"Cooperative team mates, yearly apparaisal is average, work environment is good, open to innovation, high quality products, colleagues comes from various cultural backgrounds","Growth is slow, work pressure is very high I have to work 15-16 hours in a day"
Jr Officer- Mis,Gurgaon,,,4 Mar 2018,4.0,1.0,1.0,3.0,1.0,1.0,2.0,"As this company is having all updated things like SAP, wms system etc. So i most like this company.",Nothing here is dislike.
Executive In Material Control,Gurgaon,,Supply chain management  Department,5 Sep 2018,5.0,4.0,5.0,5.0,4.0,5.0,3.0,,
,,,,,,5.0,5.0,5.0,5.0,5.0,5.0,,
Junior Spare Part Officer,Gurgaon,Full Time,Sparepart coordinator Department,0 Aug 2018,3.0,3.0,4.0,4.0,4.0,4.0,4.0,Career growth is very good and we can say that politics also play a vital role in this,Salary appraisal is not too good
Q.a Technician,Gurugram,Full Time,Quality Department,0 Aug 2018,3.0,5.0,4.0,4.0,5.0,5.0,5.0,Travel,provide right training and compensation ..
Quality Inspector,,,,2 Nov 2018,4.0,4.0,4.0,4.0,3.0,4.0,4.0,"still fallowing traditional culture , lack of innovation, poor communication between employee.  high job insecurity in this company.","Good team work with that I love the fact that I am a part of a team that markets reliable, high quality products and has a global client base."
Area Sales Manager,Patna,,BD / Pre Sales Department,4 May 2018,2.0,4.0,4.0,4.0,3.0,4.0,4.0,"Compensation is decent, but growth is slow. The work pressure is very high.","My work experience in panasonic is very good . It is one of the best company i have worked . Comapny staff, senior and teammates behaviour is very calm and good . Good salary packages and componsation.i am proud that i was the part of this company."
Sale Promoter,Mumbai,,Retail & B2C Sales Department,0 Mar 2018,4.0,3.0,2.0,5.0,1.0,2.0,2.0,Company product quality is low .,I'm doing well in panasonic. Our all team members are good. Trainer are also well qualified
Sales Executive,ETAWAH,,Corporate Communication Department,1 Oct 2019,4.0,3.0,4.0,4.0,3.0,4.0,4.0,Service issue,Its a good platform to learn and develope your skills.
Operator,,,,3 Jul 2019,5.0,5.0,5.0,5.0,3.0,4.0,3.0,As per HR ITS FIVE DAY WORKING BUT I AM WORKING SIX DAY WORKING.,Skill development & Career growth opportunities
Junior Sales Officer,Gurgaon,,,6 Jul 2018,5.0,5.0,5.0,5.0,5.0,5.0,5.0,Company culture,
Branch Coordinator,Gurgoan,,Non Voice Department,4 Apr 2018,3.0,5.0,5.0,5.0,5.0,5.0,5.0,,
Marketing Manager,Nagpur,,,1 Jul 2018,3.0,4.0,4.0,4.0,5.0,5.0,5.0,,
,,,,,,3.0,3.0,4.0,4.0,3.0,3.0,,
,,,,,,4.0,4.0,3.0,3.0,3.0,4.0,,
Area Service Manager,Ahmedabad,Full Time,,9 Jul 2019,5.0,3.0,5.0,5.0,5.0,5.0,5.0,In one word superb,Service field is hectic
Pcb,Noida,,,7 Aug 2017,4.0,5.0,5.0,5.0,5.0,4.0,5.0,I like this company,Panasonic is a good company
Ac Technician,Kanpur,,ac Department,2 Nov 2018,4.0,4.0,4.0,4.0,4.0,5.0,5.0,Customer no satisfied,The company is overall good to balance the personal life and work culture
Assistant Manager Supply Chain Management,Gurgaon,,Business Intelligence & Analytics Department,3 May 2018,4.0,4.0,4.0,3.0,5.0,3.0,4.0,The company actual profit is in negative in India,"Company culture ls very good,HR also are very dominationg towards employee but no vision and poor decision by the Mobility heads."
Mis Coordinator,Kaloor,,Marketing  Department,4 Apr 2019,5.0,5.0,2.0,5.0,5.0,5.0,5.0,No vision in mobility devision,overall very good organisation to work with.
Area Sales Manager,Ghaziabad,,BD / Pre Sales Department,5 May 2018,3.0,5.0,5.0,5.0,2.0,5.0,5.0,Job security.,Company is very good but managent is very Poor
Area Sales Manager,Jaipur,,BD / Pre Sales Department,1 Aug 2018,5.0,4.0,1.0,1.0,5.0,5.0,5.0,Job security in panasonic major concern. Bcz for give the good performancce job security is neccesary,Fine
Branch Trainer,,,,7 Mar 2018,5.0,5.0,5.0,5.0,5.0,5.0,5.0,Nothing,
Area Sales Manager,Gurgaun,,BD / Pre Sales Department,3 Aug 2018,3.0,5.0,5.0,5.0,5.0,5.0,5.0,,
Sales Executive,Kolkata,,Enterprise & B2B Sales Department,6 Aug 2018,4.0,5.0,5.0,5.0,3.0,3.0,5.0,,
,,,,,,3.0,1.0,2.0,4.0,5.0,4.0,,
,,,,,,4.0,3.0,5.0,,,,,
Commercial Co-ordinator,Bhubaneswar,Full Time,SCM & Logistics Department,4 Sep 2017,5.0,3.0,4.0,4.0,3.0,2.0,2.0,Its a good company,Working culture of branch level is very worst.I have workinf regularly 12-13 hrs yet work not finished due to unthredicals style of managers. Excess manpowers appointing where it not required & where actually require there no vacancy. Branch level promotion is like day dreams. Its very pathetic situation for off role employees bcoz they entered this organization having lot of dreams but after some days all dreams vanished as adjust themselves like a bonded labour....Read More
Data Analyst,Gurgaon,Full Time,Voice / Blended Department,2 Apr 2018,5.0,4.0,4.0,4.0,4.0,4.0,4.0,Excellent work place and company culture environment and worklife balance,Nathing found in one year
Service Engineer,Kollam,Full Time,"Operations, Maintenance & Support Department",7 Jun 2022,3.0,3.0,3.0,2.0,1.0,4.0,2.0,"Not saying as a good place to work and develop our ebility,not bad.i had worked in panasonic franchise where the owner running it for his beneficiary money only,mosf of the customers i had met in period of my work are unsatisfied with the service center.I did my best to improve it.","Salary,increment,not a good work experence."
Trade Marketing Executive,VIJAYAWADA,,Marketing Department,1 Feb 2022,3.0,3.0,2.0,1.0,1.0,1.0,1.0,Good to be part of Panasonic,In my department need to have some work life balance
Sales Promoter,KARNAL,,Retail & B2C Sales Department,1 Aug 2018,5.0,5.0,5.0,5.0,5.0,5.0,5.0,I love this company. I am very proud that  I AM PART OF IT.,Nothing
FIS,,,,8 Sep 2019,5.0,5.0,5.0,5.0,5.0,5.0,5.0,4 year program,I am doing to workong
Sales Executive,Goralhpur,,Hardware Department,9 Jun 2019,5.0,5.0,5.0,5.0,5.0,5.0,5.0,It's good products and easy to sell out.it have good specifications and that make selling Panasonic products easier,The attendance marking..they ask to mark attendance 3 times a day.
Sales Promoter,Vadakara,,Accounting & Taxation Department,0 Mar 2018,4.0,5.0,5.0,4.0,4.0,5.0,4.0,Working place is good.,"Growth and appraisal not good,"
Store Executive,Kolhapur,,,2 Aug 2018,5.0,4.0,4.0,4.0,4.0,4.0,5.0,Waiting for new job,What  I li
Assistant Manager,Jhajjar,,"Operations, Maintenance & Support Department",1 Jul 2018,1.0,3.0,3.0,3.0,2.0,3.0,2.0,,
,,,,,,4.0,1.0,1.0,3.0,3.0,1.0,,
Commercial Coordinator,Ludhiana,,Non Voice Department,5 Aug 2018,5.0,1.0,5.0,1.0,1.0,1.0,1.0,Worst culture.,Behave like slaves.
Visual Merchandiser,Guwahati,,BD / Pre Sales Department,0 Sep 2019,4.0,3.0,4.0,3.0,4.0,4.0,2.0,Seniors behavior and support is very good,Increment is very low and there is leave issue
Area Sales Manager,"Mumbai, Maharashtra, India",,BD / Pre Sales Department,7 Jan 2019,5.0,5.0,5.0,5.0,5.0,5.0,5.0,There is a huge chance to grow career,I don't deslike anything in this company
Regional Manager Marketing,Bangalore,,,9 May 2018,3.0,2.0,2.0,2.0,1.0,3.0,2.0,Not too fussy about processes,"Appraisal, work life balance, lack of authority"
AM Planning And CS,Gurgaon,,Strategic Management Department,3 Sep 2018,4.0,4.0,4.0,4.0,4.0,4.0,4.0,Work culture and Head support,Politics
Brand Promoter,Lucknow,,Sales Department,7 Oct 2018,3.0,2.0,4.0,3.0,4.0,3.0,4.0,Excellent work area,No comment
Zonel Sales Supervisor,Gwalior,,Marketing Department,1 Jan 2019,5.0,4.0,4.0,3.0,4.0,5.0,4.0,company is good and product is fine but logistics systems is not good,growth is very slow
Sales Officer,GUWAHATI,,Retail & B2C Sales Department,1 Sep 2018,5.0,4.0,4.0,3.0,4.0,5.0,4.0,,
Warehouse Manager,Puzhal Chennai,,SCM & Logistics Department,2 Oct 2018,3.0,4.0,5.0,4.0,4.0,5.0,4.0,,
Branch Service Officer,Thane,,Non Voice Department,2 Jan 2019,1.0,3.0,3.0,2.0,3.0,3.0,3.0,,
,,,,,,2.0,2.0,1.0,1.0,3.0,1.0,,
Tool Room Operator,Gurgaon,,"Operations, Maintenance & Support Department",7 Sep 2018,5.0,5.0,5.0,5.0,4.0,5.0,5.0,All to good,All to good
Senior Executive,Jhajjer,,Accounting & Taxation Department,8 Aug 2018,5.0,5.0,5.0,5.0,5.0,5.0,5.0,No stress,Nothing
Branch Marketing Manager,Ranchi,,Marketing Department,6 Nov 2019,3.0,1.0,2.0,3.0,1.0,1.0,1.0,Hard Work resources,Pathetic Work Culture at Branch Level
FIS ISD,Kolkata,,Retail & B2C Sales Department,9 Aug 2018,5.0,5.0,5.0,5.0,5.0,5.0,5.0,Overall Excellent,No one.
Area Sales Manager,Nagpur,,Enterprise & B2B Sales Department,8 Jun 2018,1.0,1.0,1.0,1.0,1.0,1.0,1.0,Nothing,Nothing
Ac Technician,Thiruvananthapuram,,Service  Department,5 Feb 2019,5.0,5.0,5.0,5.0,5.0,5.0,5.0,My dream,I love Panasonic
Sales Executive,Nashik,,BD / Pre Sales Department,7 Oct 2019,4.0,4.0,4.0,4.0,5.0,4.0,3.0,Training and all support,No
Area Sales Manager,Kolkata,,BD / Pre Sales Department,4 Apr 2018,4.0,5.0,5.0,5.0,5.0,4.0,3.0,A very Popular and accepted Brand,The Objective and Work Process is not stable
Area Sales Manager,Durgapur,,BD / Pre Sales Department,0 Mar 2018,5.0,4.0,5.0,4.0,5.0,5.0,5.0,Excellent Organisation to work with. I wish to retire from here,Need to be more aggressive
Sales Executive,Jodhpur,,Sale Department,4 Oct 2019,4.0,5.0,4.0,5.0,5.0,4.0,3.0,Good experience,Growth
Assistant Manager Quality Assurance,Chennai,,Production & Manufacturing Department,6 Nov 2018,5.0,4.0,4.0,4.0,5.0,4.0,4.0,Yes,Nothing
Associate Engineer,Jhajjar (Dadri Toe),,PASI Department,5 Feb 2018,5.0,4.0,4.0,4.0,4.0,5.0,4.0,The company is open to innovation .it adopts latest technology.i love the fact that i am a part of team has a global client base.i also like here good policy.,Growt is slow .work pressure is very high.i fell stress here.
Deputy Manager ( Logistics And Operation),Gurgaon,,Customer Servic Department,8 Aug 2018,5.0,4.0,4.0,4.0,4.0,4.0,5.0,Gud HR polices,Overall a good work place
Sales Executive/officer,Saki Naka,,,1 Oct 2018,5.0,5.0,5.0,5.0,5.0,5.0,5.0,Panasonic is a good company,Bad experience mudra pay roll
Sales Executive,Makati City,,Sm appliance center Department,5 Feb 2020,5.0,5.0,5.0,5.0,5.0,5.0,5.0,Good to sell in market good quality and the result is  customers satisfied any purchase item.and the no.1i like this  brand is to save the mother earth because of new to technology ..,"As of now the management in panasonic is good  for me.because panasonic be on time to go the payroll of the manpower  in local agency.but
the problem is the local agency management,delay most off the time because the salary and incentives late at the payroll time and big tax..fyi may sallary is not high for the high tax.this is my  experience in almost 6 years in this company..i have a more recomendation from my client good customer service but unnoticed to panasonic management in my yearly appraisals
So i decide to work abroad and i want to learn and more skill in others other country .....Read More"
Branch Marketing Manager,,,Marketing Department,2 Apr 2019,3.0,3.0,4.0,3.0,4.0,3.0,3.0,Overall Good company,Working Culture
Sr. Executive,Gurgaon,,SCM & Logistics Department,2 Oct 2018,5.0,5.0,5.0,5.0,5.0,5.0,5.0,Night Shift working,
"Assistant Manager Supplier Quality,NPD",Gurgaon,,Quality Department,3 Aug 2018,4.0,5.0,5.0,5.0,5.0,5.0,5.0,,
Quality Engineer,"Jhajjar ,Haryana",,Procurement & Purchase Department,3 Jan 2021,4.0,3.0,5.0,3.0,4.0,4.0,5.0,,
BMC-branch Marketing Coordinator,Gurgaon,,Business Process Quality Department,1 Nov 2018,4.0,5.0,4.0,4.0,4.0,4.0,4.0,,
,,,,,,4.0,4.0,2.0,2.0,3.0,3.0,,
,,,,,,4.0,4.0,2.0,2.0,3.0,3.0,,
Assistant General Manager - OD And LnD,,Full Time,HR Operations Department,7 Sep 2018,5.0,5.0,5.0,3.0,5.0,4.0,5.0,Empowerment  to individuals,Compensation
Computer Accountant,Raipur,Full Time,Accounts  Department,3 Oct 2018,5.0,4.0,5.0,3.0,3.0,4.0,3.0,Career  opportunity and training to any required task,No need to disclose
Assistant Manager,Indore,Full Time,,1 Aug 2018,5.0,4.0,5.0,3.0,3.0,4.0,3.0,Lesser stress one can focus and balanced on carrier and personal life,Poor
Sales Executive,,,,0 Jan 2019,3.0,4.0,4.0,5.0,4.0,4.0,5.0,There was no vision in Marketing and sales department. Very week HR . VERY POOR R&D Dept. All over very poor experience.,"Overall good company if you are really want to do work,"
Area Sales Manager,Gurgaon/Gurugram,,,7 Jan 2022,1.0,4.0,3.0,3.0,3.0,4.0,4.0,"Work life balance are missing, due to very high expectations from top management",Culture
National Technical Training Manager,Gurgaon/Gurugram,,Customer Service Department,5 Apr 2022,4.0,1.0,1.0,1.0,1.0,1.0,1.0,Nothing as such,Good working environment all facilities available at work. Enjoyed working at Panasonic
Store Keeper,,,,0 Jan 2019,4.0,3.0,5.0,4.0,4.0,4.0,4.0,Nothing you dislike,
Assistant Manager - Sales,Kochi,,,1 Nov 2018,5.0,4.0,4.0,4.0,5.0,4.0,4.0,,
Area Sales Manager,Nagpur,,Enterprise & B2B Sales Department,4 May 2018,5.0,4.0,4.0,4.0,5.0,4.0,4.0,,
Zonal Trainer Mumbai,Mumbai,,,9 Jan 2022,5.0,5.0,5.0,1.0,5.0,5.0,3.0,,
,,,,,,5.0,5.0,1.0,5.0,5.0,3.0,,
,,,,,,5.0,5.0,4.0,4.0,5.0,4.0,,
,,,,,,4.0,4.0,4.0,4.0,4.0,4.0,,
Retail Manager,,Full Time,,6 Mar 2019,5.0,5.0,5.0,5.0,3.0,5.0,3.0,Poor Leadership,Culture
Software Developer,Gurgaon,,Software Development Department,7 Oct 2018,1.0,5.0,5.0,5.0,3.0,5.0,3.0,Good teem mate.,Cerrier growth.
Sales Excutiv,INDORE,,Sales  Department,0 May 2018,4.0,1.0,3.0,1.0,1.0,1.0,1.0,Nothing,HR practicses
Sell Out & Operations Manager,Nagpur,,Mobility Sales Department,0 Oct 2018,2.0,3.0,3.0,3.0,4.0,4.0,4.0,I have got lots of knowlagde regarding logistics. Good experiance..,No
Logistic Coordinator,Dehradun,,,7 Apr 2018,4.0,3.0,1.0,3.0,1.0,1.0,1.0,Yes i like,Benefits n job security
Area Service Incharge,LU,,,2 Oct 2018,5.0,5.0,5.0,1.0,1.0,2.0,2.0,Overall employee friendly,To much Work load ...
Service Engineer,Chennai,,Service  Department,0 Dec 2018,5.0,4.0,5.0,3.0,4.0,4.0,3.0,It's very good about our knowledge,There was not good career growth as a sales executive
Junior Sales Officer,Indore,,Retail & B2C Sales Department,3 Nov 2018,5.0,4.0,5.0,3.0,4.0,4.0,3.0,,
Assistant Manager,,,,4 Aug 2018,4.0,2.0,5.0,2.0,3.0,5.0,4.0,,
Sales Executive,New Delhi,,Administration Department,8 Feb 2019,3.0,5.0,5.0,4.0,5.0,5.0,5.0,,
,,,,,,4.0,4.0,3.0,4.0,4.0,2.0,,
,,,,,,4.0,4.0,3.0,4.0,4.0,2.0,,
,,,,,,2.0,4.0,3.0,1.0,3.0,2.0,,
Sales Executive,Sangli,Full Time,Sales  Department,3 Oct 2018,5.0,5.0,5.0,5.0,5.0,5.0,5.0,Nice experiance,No deslike
Spice Hotspot,Ahemdabad,,Sels Department,7 Oct 2019,5.0,5.0,5.0,5.0,5.0,5.0,5.0,Nice job,Nice job
Sales Manager,Lucknow,,BD / Pre Sales Department,6 Sep 2017,5.0,5.0,5.0,5.0,5.0,5.0,5.0,Panasonic is the only organisation which take care of their employee Monetory & Emotionally.Panasonic has establised a Vibrant culture within organisation & working on wellness & engagement programe Branch & Location wise.,Nothing to be dislike about Panasonic as its trust worthy oraganisation
Junior Spare Part Officer,Gurgaon,,Spare parts Department,6 May 2018,5.0,4.0,4.0,4.0,4.0,5.0,4.0,"Working Environment is good
Supporting staff 
Good growing company",Salary
Executive,Gurgaon,,Non Voice Department,5 Mar 2018,5.0,5.0,5.0,4.0,5.0,5.0,4.0,Good people here,Nothing i loving
Executive Assistant,Bangalore,,HR Operations Department,6 Sep 2019,5.0,5.0,5.0,5.0,5.0,5.0,5.0,"Had a great time while working,",No words
Sales Executive,Dabagardance,,Operations Support Department,6 Mar 2018,3.0,4.0,4.0,3.0,2.0,2.0,2.0,Team work and the knowledge of productivity,No incentive scheme and products quality not satisfied.
Retail Manager,Begumpet,,Enterprise & B2B Sales Department,9 Feb 2018,5.0,5.0,5.0,5.0,2.0,5.0,2.0,Every thing is perfect even company norms also good,No job security
Retail Manager,Pune,,mobile Department,9 Apr 2019,1.0,1.0,1.0,1.0,1.0,1.0,1.0,worst place to work,cultor
Area Sales Manager,Nagpur,,BD / Pre Sales Department,4 Sep 2018,5.0,5.0,5.0,5.0,5.0,5.0,5.0,,
,,,,,,5.0,5.0,5.0,5.0,5.0,5.0,,
Branch Service Manager,Chennai,Full Time,Non Voice Department,7 Mar 2018,5.0,4.0,5.0,5.0,5.0,5.0,5.0,Good for learning & development,None
Jr. Sales Officer,Jodhpur,,Enterprise & B2B Sales Department,7 Oct 2018,5.0,4.0,4.0,5.0,5.0,5.0,5.0,Open culture,a good company with nice culture and work ethics
Quality Assurance Engineer,Jhajjar,,,9 Oct 2018,4.0,4.0,4.0,5.0,5.0,5.0,5.0,Panasonic is a good company our team members are also very good,Growth  is very slow
Assistant Manager- After Sales Services,Gurgaon,,,6 May 2018,5.0,3.0,3.0,2.0,4.0,4.0,3.0,Location,No future roadmap
Area Sales Manager,Azamgarh,,BD / Pre Sales Department,1 Jun 2021,5.0,3.0,3.0,2.0,4.0,4.0,3.0,Good company,Salary not issue. Good modules
Sales Executive,Kotdwara,,Sales  Department,7 Mar 2018,3.0,4.0,5.0,4.0,4.0,4.0,3.0,Product quality is very good.,Promotion is poor.
Assistant Manager,Gurgaon,,Construction Engineering Department,7 Aug 2018,1.0,5.0,5.0,5.0,5.0,5.0,5.0,good experience with panasonic company always give a good product and quality smartphone brand .,Nothing
Sales Executive,Chennai,,Sales Department,6 Mar 2018,5.0,3.0,3.0,2.0,3.0,4.0,3.0,,
Junior Sales Officer.,"Kolkata, West Bengal",,Retail & B2C Sales Department,2 Apr 2023,4.0,1.0,1.0,3.0,2.0,1.0,1.0,,
Sales Executive,Delhi NCR,,Retail Sales Department,5 Oct 2020,5.0,3.0,4.0,2.0,4.0,5.0,3.0,,
,,,,,,4.0,4.0,4.0,4.0,5.0,3.0,,
,,,,,,4.0,5.0,4.0,4.0,5.0,5.0,,
Store Keeper,Kuwait,,Ardiya Department,6 Mar 2018,5.0,4.0,5.0,5.0,5.0,5.0,5.0,I like my company Manegement,All company is having something dislike..but i don't see anything is dislike
Sales Officer,Kolkata,,Corporate Communication Department,1 Oct 2018,5.0,5.0,5.0,5.0,5.0,5.0,2.0,The best Co to work in all aspects,In my experience growth not happen
Financial Planning Officer,Gurgaon,,Finance Department,6 Mar 2018,4.0,5.0,3.0,2.0,4.0,4.0,3.0,"Teammates, environment and work-life balance.",Salary/appraisal off roll employee policies
Ac Technician,Haldwani-cum-Kathgodam,,Retail Store Operations Department,4 Jul 2018,5.0,4.0,5.0,4.0,5.0,4.0,4.0,360 degree exposure.,Scope for honing specialization limited
Counter Sales Executive,Allahabad,,sales Department,1 Oct 2019,5.0,4.0,5.0,4.0,5.0,4.0,4.0,Good,Culture
Hr Administration Executive,Jajhar,,,8 May 2018,5.0,4.0,5.0,4.0,4.0,4.0,4.0,Hirring  or  any good post,Cco
Product Manager,Gurgaon,,Marketing Department,0 May 2019,4.0,4.0,5.0,4.0,4.0,4.0,4.0,,
Paint Shop Engineer,Chennai,,,3 Feb 2018,4.0,4.0,2.0,3.0,5.0,5.0,2.0,,
State Service Incharge,Raipur,,,3 Jul 2018,5.0,1.0,3.0,3.0,4.0,3.0,2.0,,
National Service Head,Nagpur,,Department  Department,0 May 2018,5.0,4.0,3.0,3.0,5.0,3.0,2.0,,
,,,,,,5.0,5.0,5.0,5.0,5.0,5.0,,
,,,,,,5.0,5.0,5.0,5.0,5.0,5.0,,
,,,,,,5.0,5.0,5.0,5.0,5.0,5.0,,
