Title,Place,Job_type,Department,Date,Overall_rating,work_life_balance,skill_development,salary_and_benefits,job_security,career_growth,work_satisfaction,Likes,Dislikes
Senior Executive,Gurgaon,,Software Development Department,3 May 2018,2.0,3.0,1.0,4.0,3.0,3.0,1.0,"Compensation and benefits
Company's infrastructure",no growth and learning opportunity for a software developer
Product Parmotor,Jaipur,,Sales  Department,2 Apr 2019,5.0,4.0,5.0,3.0,3.0,4.0,4.0,The company is open to innovation and readily adopts latest technology,Good
Sales Executive,Pune,,BD / Pre Sales Department,5 Jan 2020,5.0,5.0,5.0,5.0,5.0,5.0,5.0,"I'm satisfied for this job , training",None of the
Sales Executive,Lucknow,,Sales  Department,5 Dec 2019,4.0,3.0,4.0,3.0,2.0,4.0,3.0,Good learnings about technology and customer offering.,Less customer query and brand visibility in market.
Sales Executive,Chennai,,Retail & B2C Sales Department,0 Apr 2021,5.0,5.0,5.0,5.0,5.0,5.0,5.0,"Good Work Environment, Company Policies are Good",But its Currently Not Working in Panasonic
Sales Executive,Vijayawada,,Sales Department,9 Sep 2019,5.0,3.0,4.0,4.0,3.0,4.0,3.0,Its overall good experience working with Panasonic,Need to improve brand image and supporting staff like sales promoters and branding at main towns
Diploma Trainee,Navi Mumbai,,,1 Jan 2020,5.0,5.0,5.0,4.0,5.0,5.0,5.0,Company culture very good,No any thing
Mis Sales Coordinator,Jodhpur,,Retail & B2C Sales Department,1 Jan 2020,4.0,4.0,4.0,4.0,3.0,4.0,4.0,Its a great Experience for us and good product range & nice quality for appliances  . again to thank to multiplier team,Great team
Senior Operator,,,"Operations, Maintenance & Support Department",9 Apr 2019,3.0,3.0,3.0,1.0,4.0,3.0,2.0,,
,,,,,,3.0,3.0,1.0,4.0,3.0,2.0,,
Computer Data Entry Operator,"Nagole ,hyderabad",Full Time,,8 Dec 2019,3.0,3.0,4.0,4.0,5.0,5.0,3.0,Yes ofcourse,I am not finding any growth in panasonic company
Executive Front Office,Gurgaon,,Back office Department,4 May 2018,5.0,4.0,4.0,3.0,4.0,4.0,4.0,Yes,Yes
Filed Officer,Chandigarh/Ludhiana A,,Accounting & Taxation Department,3 Oct 2020,5.0,4.0,4.0,4.0,3.0,3.0,3.0,Good experience for job,Boos attitude
Front Office Administrator,Ahmedabad,,Manager Department,5 Aug 2019,5.0,5.0,5.0,5.0,5.0,5.0,5.0,Work environment & team work always each & every work is excellent,Taking decision very late but when take decision so always excellent take decision by company
Senior Executive,Alipur Delhi,,Facility Management Department,9 Sep 2020,5.0,5.0,5.0,5.0,5.0,5.0,5.0,Yes,Nothing
Team Leader,Navi Mumbai,,Enterprise & B2B Sales Department,2 Feb 2020,5.0,4.0,4.0,5.0,4.0,5.0,4.0,Service,Nothing
Jr Branch Officer,Nagpur,,Operations Department,8 Dec 2019,5.0,5.0,4.0,4.0,4.0,5.0,4.0,Really good culture & office staff good activity done by the company,No one
Branch Commercial Controller,Coimbatore,,Accounting & Taxation Department,2 Oct 2020,4.0,3.0,5.0,4.0,4.0,4.0,4.0,Good brand and well support team members and all.,Work presure is nothing issue but countinue late night working
Retail Manager-Sales Planning,Gurgaon,,Corporate Communication Department,3 Oct 2018,5.0,4.0,5.0,3.0,3.0,5.0,2.0,Good,Hr department not good
Sales Executive,Surat,,Retail & B2C Sales Department,8 Feb 2019,5.0,5.0,5.0,4.0,4.0,5.0,4.0,"The company is open to innovation and readily adopts latest technology. I love the fact that I am a part of a team that market reliable, high quality products and has a global clients base. Another Plus point is that my colleagues come from various cultural backgrounds, and we work happily in collaboration. I also like the employee re-hire policy here...",Compensation is decent but growth is slow...
Service Engineer,Noida,,Production & Manufacturing Department,7 Jan 2020,4.0,4.0,4.0,4.0,5.0,4.0,5.0,Good working as a company,Awsame
Branch Marketing Manager,Bangalore,,Marketing Department,8 Sep 2020,1.0,2.0,1.0,3.0,1.0,1.0,1.0,Japanese technology,Worst people managing in India...
Area Sales Manager,Hyderabad/Secunderabad,,BD / Pre Sales Department,3 May 2021,1.0,1.0,1.0,2.0,1.0,1.0,1.0,Worst company ever worked,Working cultural is not good
Area Sales Manager,Jaipur,,Enterprise & B2B Sales Department,8 Dec 2019,4.0,4.0,5.0,4.0,3.0,4.0,4.0,It was good learning and career growth.,appreciation misses
Sales Executive,Bhubaneswar,,,7 Aug 2019,5.0,5.0,5.0,4.0,4.0,4.0,3.0,The company is very good,The company have not give any opportunities to old/experience employee to growth/promotion in company.
Sales Officer,AHMEDABAD,,Lighting  Department,6 May 2020,4.0,3.0,4.0,5.0,5.0,5.0,3.0,Open Innovation,No comments
Sales Executive,Pune,,Retail Store Operations Department,3 Mar 2020,4.0,3.0,4.0,5.0,5.0,5.0,3.0,"It's nice to work here good place to devlop your professional skills.
It's nice experience to work 1st time in Japanese culture",Job sequrity & internal politics
Sr. Executive Import Export Logistics,,,,0 Dec 2019,4.0,4.0,4.0,4.0,4.0,4.0,4.0,"Air conditioner installation repairing gas charging LED installation washing machine demo installation repairing
Micro oven testing
Jigar installation",No
Moradabad,Moradabad,,Authorised service centre senior engineer  Department,3 Oct 2019,4.0,2.0,5.0,4.0,2.0,4.0,3.0,Good,No
Warehouse Executive,,,,6 Oct 2018,5.0,5.0,5.0,5.0,3.0,5.0,2.0,,
,,,,,,3.0,5.0,3.0,4.0,4.0,4.0,,
Sales Executive,Ahmedabad,Full Time,Sales Department,1 Mar 2020,4.0,5.0,5.0,4.0,4.0,4.0,4.0,Overall company support to employees,Working environments is very good
Engineer,Manesar,,,7 May 2022,5.0,5.0,5.0,5.0,5.0,5.0,5.0,Very good company,NO SUPPORT
Regional Trainer East In CE Product,"Kolkata, West Bengal, India",,Customer Service Department,8 Jun 2020,2.0,1.0,3.0,2.0,1.0,1.0,2.0,THERE ARE NO JOB SECURITY FOR SENIOR EMPLOYEE,Good experience
Jso,Hyderabad,,,7 Dec 2019,4.0,4.0,4.0,4.0,4.0,4.0,4.0,Good experience,"There culture and team was awesome, every day I learn something good. Self improvement and skill development."
Branch Marketing Manager,"Ghaziabad, Uttarpradesh .",,Marketing Department,1 Aug 2022,3.0,5.0,5.0,2.0,5.0,5.0,1.0,Finical growth is almost zero.,Good in terms of quick learner.
Trade Marketing Executive,Gurgaon,,Marketing Department,9 Aug 2019,4.0,3.0,5.0,4.0,4.0,4.0,3.0,Horizontal growth,Working with Panasonic is a great opportunity for me . My bosses are very supportive and friendly . They taught me lot of things which helps me to grow . Overall very professional and challenging.
Territory Sales Manager,Coimbatore,,Mobility Department,2 Apr 2019,4.0,4.0,4.0,4.0,3.0,5.0,3.0,I don't see any bad in this company . Most of the time they collapse mobility team . That's the only thing I dislike .,Good work
Customer Care Officer,West Bengal,,Operations Support Department,3 Jun 2020,1.0,1.0,1.0,1.0,1.0,1.0,1.0,I am not satisfy with Panasonic,Job security is good and work life balance is good
Assistant Manager Quality Assurance,Chennai,,Production & Manufacturing Department,1 May 2022,4.0,5.0,3.0,4.0,5.0,3.0,3.0,Career growth and new learning is slow,Led lcd reparing
Electronics Engineer,Delhi NCR,,Led reparing Department,3 Sep 2019,5.0,5.0,5.0,3.0,5.0,4.0,4.0,Nothing,
Senior Sales Executive,Dhanbad,Full Time,Engineering & Manufacturing Department,7 Dec 2019,2.0,1.0,1.0,1.0,1.0,1.0,1.0,"Average,just passing time there,no future,no life there",Average
Deputy Manager-sales,Gurgaon,Full Time,Business Intelligence & Analytics Department,0 Apr 2021,3.0,4.0,4.0,3.0,4.0,2.0,2.0,Good and organised culture. Japanese team is supportive.,Lot if politics and no direct connect with top stakeholders of company.
Apprenticeship,Jhajjar,,Administration & Staff Department,1 Jul 2019,4.0,5.0,4.0,5.0,3.0,3.0,3.0,"I like 5 day working system & food in this company. 
Travelling system is also good. 
Company vehicles pick and drop employees from in the radius of 55 km of plant.",Salary is less according to work
Marketing Executive,Khaga,,,4 Jun 2022,5.0,5.0,5.0,3.0,3.0,4.0,3.0,Nice And Good Company,Due to Covid I had left my job
Assistant Manager,Gurugram,,"Operations, Maintenance & Support Department",3 Feb 2020,5.0,5.0,5.0,5.0,5.0,5.0,4.0,Learning,Growth
"DGM After Market, Customer Service",Gurgaon,,Operations Department,6 Jun 2019,4.0,3.0,3.0,5.0,5.0,5.0,3.0,It's a great company to work...Good drive and vision and high on job security,Processes are Man driven and compleX
In Shop Demonstrator,Serampore,,Mobile  Department,0 Jan 2019,3.0,3.0,3.0,3.0,1.0,2.0,1.0,"I dislike the price difference between the  same model in online and offline . There are huge service problem from the authorized service centre .dden. Hang problem , software update problem.and many more .","Working time 9am to 6 pm, and Monday to Friday. good hike average 9% annual, job is fully secured."
Senior Technical Consultant,Mumbai,,,6 Oct 2019,4.0,3.0,4.0,3.0,5.0,4.0,5.0,"You need provide solution, 24/7 issues , internal users are said every thing urgent",Company culture is very great. I hope join this group (ujjivan).
Sales Officer,Jaipur,,IAQ( fan)  Department,6 Feb 2020,5.0,5.0,5.0,5.0,5.0,5.0,5.0,No,Over all good I worked with Panasonic aprox 10 years but management not parmote anyone because of  they said we have no policy for promotion. So that after 10 years I left the Panasonic.
Fis,Ludhiana,,Sales Department,1 Oct 2019,4.0,4.0,5.0,3.0,3.0,2.0,1.0,See above,
Panasonic Service Center,Sangli,Full Time,,1 Dec 2019,5.0,5.0,5.0,1.0,2.0,4.0,3.0,All Over,Every thing is good about teamates
Regional Sales Officer,Ghaziabad,Full Time,Marketing Department,5 Oct 2019,5.0,5.0,5.0,4.0,5.0,5.0,5.0,About cinvenyence,I love panasonic.
Senior Sales Promoter,,,,6 Jul 2019,5.0,5.0,5.0,5.0,5.0,5.0,5.0,I love my job.,Very good job and very good
Sales Team Leader,,,,2 Mar 2018,5.0,5.0,5.0,5.0,5.0,5.0,5.0,Nothing,Worst company culture
Sales Executive,Banswara,,Sales Department,6 Oct 2019,5.0,4.0,3.0,4.0,4.0,4.0,4.0,Worst Culture in the company,Salary
Senior Demonstrator,Chennai,,Marketing Department,0 Dec 2019,5.0,4.0,3.0,4.0,4.0,4.0,4.0,Work life,"Very very good  culture, Good job i have done 6yr something ."
Area Sales Manager,Gurgaon,,BD / Pre Sales Department,8 Sep 2019,1.0,5.0,5.0,5.0,4.0,5.0,4.0,No,Career growth
Ac Technician,Gurgaon,,Service engineer Department,4 Nov 2019,5.0,5.0,4.0,4.0,5.0,4.0,5.0,Nothing,
Junior Executive Production,Gurgaon,,"Operations, Maintenance & Support Department",8 Jun 2019,5.0,1.0,1.0,1.0,1.0,1.0,1.0,,
Sales Executive,Mangalore,,Retail & B2C Sales Department,4 Aug 2019,5.0,5.0,4.0,4.0,4.0,4.0,4.0,,
,,,,,,5.0,4.0,4.0,5.0,5.0,5.0,,
,,,,,,4.0,5.0,4.0,4.0,5.0,4.0,,
Diploma Engineering Training,Haridwar,Full Time,,4 Feb 2019,4.0,3.0,4.0,3.0,2.0,4.0,3.0,"The company is open to innovation and readily adopts latest technologies. I love the fact that I am a part of a team that markets reliable, high-quality products and has a global client base.",Panasonic is best but a Anchor by Panasonic is bad about his own management system
Design Coordinator,Thane,Full Time,,1 Apr 2022,4.0,5.0,5.0,4.0,4.0,4.0,4.0,Working culture and work life balance,Leaders are not supportive
Electrician,Haridwar,,Maintenance Department,3 Jan 2020,5.0,1.0,1.0,3.0,1.0,1.0,3.0,Very good,Very good
Sales Executive,HYDERABAD,,Home appliances  Department,6 Jun 2019,4.0,4.0,4.0,4.0,4.0,4.0,3.0,feeling better working with Panasonic company,Nothing
Area Manager,Chandigarh,,Construction Engineering Department,0 Mar 2019,5.0,5.0,5.0,5.0,4.0,5.0,5.0,Best company for study and learning because of Panasonic diamonds like Mr. Narender Negi and Mr Sabyasachi Basu,Job Security
Quality Inspector,Sholavaram,,Quality Department,0 Apr 2019,5.0,5.0,5.0,5.0,5.0,5.0,5.0,"It's very  good job , I have learn lot of things this company then what the way inspection the product and how handle this product, checking methods etc.,",Partiality of workers
Sales Promotor,Nellore,,,8 Nov 2017,4.0,4.0,3.0,5.0,5.0,4.0,3.0,My 1st step is sales in Panasonic promoter,"Recently I had work in Panasonic as a sales promotor I resigned in company becoz of there is growth in company 
So many people have much talent but the company don't give any opportunity for the next promotion"
Sales Manager,Kolkatta,,Sales Department,2 Nov 2019,5.0,5.0,4.0,3.0,3.0,3.0,2.0,Because it's a brand,Very bad politics
Area Sales Manager,"Shahjahanpur, Uttar Pradesh",,Retail & B2C Sales Department,2 Jan 2023,5.0,5.0,5.0,5.0,5.0,5.0,5.0,Was Good experience with panasonic..,nothing
Branch Marketing Manager,Mimbai,,Marketing Department,9 Jun 2020,5.0,5.0,5.0,5.0,5.0,5.0,5.0,None,
Sales Executive,Jaipur,Full Time,Operations Support Department,4 Mar 2020,5.0,5.0,5.0,5.0,5.0,5.0,5.0,Freedom,Torchering from sinniore
Territory Sales Manager,,,,6 Mar 2019,5.0,5.0,5.0,5.0,5.0,5.0,5.0,Ty,"Unfortunately, I found the upper executive levels more interested in career advancement than company improvement and performance. There are pockets of very good peoy and work ethic but they are stifled by the environment"
Business Development Officer,Bhubaneswar,,BD / Pre Sales Department,0 Aug 2018,5.0,5.0,5.0,5.0,5.0,5.0,5.0,Not any as such I could find,Good work
Manager,Mumbai Andheri East,,Panasonic service center Department,8 Feb 2019,5.0,3.0,4.0,4.0,3.0,5.0,4.0,No,work life balance
Air Condition Technician,Chandigarh,,Engineer  Department,7 Aug 2019,5.0,5.0,5.0,5.0,5.0,5.0,5.0,job security... working on off role position from last more than 4 years...,Such a good team work and nice salary
Warehouse Engineer,Kolkata,,,1 Dec 2019,5.0,4.0,5.0,4.0,4.0,4.0,4.0,Good,Good
Former Sales/ JSO,Ghaziabad,,consumer durables (AC) Department,3 Apr 2019,4.0,4.0,4.0,5.0,4.0,5.0,5.0,Nothing,Un systamatic working. Work culture.
Air Condition Technician,Kurnool Sreenivasa Aircondition,,,5 Jul 2019,5.0,4.0,4.0,5.0,4.0,5.0,5.0,,
FIS,Jaipur,,Retail & B2C Sales Department,2 Sep 2019,5.0,4.0,3.0,3.0,2.0,4.0,2.0,,
Senior Branch Manager,Raipur,,Retail & B2C Sales Department,9 Jun 2019,3.0,5.0,5.0,5.0,5.0,5.0,5.0,,
,,,,,,5.0,5.0,5.0,5.0,5.0,5.0,,
,,,,,,2.0,4.0,2.0,2.0,4.0,2.0,,
Production,Dadritoi,Full Time,Production  Department,2 Oct 2019,5.0,5.0,5.0,5.0,5.0,5.0,5.0,Work,Work
FIS Panasonic,LUDHIANA,Full Time,Isp Department,1 Aug 2019,5.0,5.0,5.0,5.0,5.0,5.0,5.0,Growth,No reason
Assistant Manager Pricing Services,Gurgaon/Gurugram,,Commercial Department,8 Dec 2022,2.0,2.0,2.0,1.0,3.0,2.0,1.0,Nothing to be added as quality,"Poor management, average quality peers,low salary"
Trainee,,,,0 Sep 2019,5.0,3.0,5.0,3.0,2.0,3.0,3.0,"Company policies are good, it helped me evolve and grow. Support from management is good.",Work life balance
Senior Executive,Jhajjar,,Engineering Department,0 Jun 2019,5.0,3.0,5.0,3.0,2.0,3.0,3.0,Operator,Nothing
Area Service Manager,Pune,,After Sales Service & Repair Department,7 Apr 2022,4.0,5.0,5.0,5.0,5.0,5.0,5.0,"According to my experience with Panasonic, Panasonic is the best",According to me nothing is like dislike
Operator,Jhajjar,,Engineering & Manufacturing Department,5 Jul 2018,5.0,4.0,5.0,5.0,3.0,4.0,5.0,management,Apprentice k bad no job
Team Leader,New Delhi,,Cs.service  Department,5 Dec 2018,5.0,5.0,4.0,5.0,5.0,5.0,5.0,Good culture and opportunity to become a leader,Top management
Apprentice Trainee,Dadri Toye Jhajjar Haryana,,Administration & Staff Department,6 Apr 2021,5.0,5.0,5.0,5.0,5.0,5.0,5.0,,
"Assistant Manager, Quality Assurance And Production",Gurgaon,,Quality assurance Department,6 May 2019,5.0,5.0,5.0,5.0,5.0,5.0,5.0,,
,,,,,,5.0,3.0,5.0,5.0,5.0,4.0,,
Sales Manager,Gurgaon,Full Time,,8 Mar 2022,3.0,5.0,3.0,4.0,2.0,3.0,3.0,Culture and location,Growth and company progress
Sales Officer ( Channel Sales ),Jabalpur,,,2 Apr 2019,5.0,4.0,4.0,5.0,4.0,5.0,4.0,It is a good electronics organization.,Good opportunities for grow up career
"Head Planning, Logistics And VRLA Battery Businesses",Gurgaon,,Strategic planing  Department,9 Apr 2019,1.0,1.0,1.0,3.0,1.0,4.0,1.0,It was mix after new management change in my department it become terrible,"Pathetic internal politics, baised,complince issues etc."
Senior Opretor,Jhajjar(haryana),,Quality  Department,3 Mar 2019,5.0,4.0,4.0,3.0,4.0,3.0,5.0,Panasonic India pvt Ltd has a good company all staff members goods,As good carrier as a good security good carrier growth
National Key Account Manager,Gurgaon,,,2 Jul 2019,2.0,2.0,1.0,1.0,2.0,1.0,1.0,Nothing,Everything
Jr. Mis Officer,Gurgaon,,,1 Dec 2022,5.0,5.0,5.0,5.0,5.0,5.0,5.0,Perfect corporate company to work with,Everything was good. No complains
Regional Marketing Manager,Bangalore,,Marketing Department,9 Jun 2019,5.0,3.0,5.0,3.0,5.0,4.0,3.0,Nothing,Trade mktg department head is not right
Assistant Manager Qa,Daman & Diu,,,8 Jun 2021,2.0,2.0,3.0,4.0,3.0,1.0,1.0,Free culture,Orthodox thinking
Technician,Gurgaon,,SCM & Logistics Department,2 Apr 2019,3.0,3.0,4.0,2.0,4.0,5.0,5.0,I'm very interested at working Panasonic company..,No problem
It Project Coordinator,Gurgaon,,Compensation & Benefits Department,8 Mar 2019,4.0,4.0,3.0,4.0,4.0,4.0,4.0,Working atmosphere is good at Panasonic. very cool ..,late working hours
Assistant Manager,Gurgaon,,,2 Jan 2019,4.0,5.0,4.0,5.0,4.0,5.0,5.0,"its a great place to work, feel good to work here. i learned lot of things whether its professional or personal. found a genuinely nice person. 
Thanks to God.",As such nothing.
Assistant Manager Ehs,Jhajjar,,,0 Jun 2019,4.0,3.0,3.0,3.0,3.0,3.0,3.0,Free transport,Over stay.
Senior Software Engineer Testing,Gurgaon,,Quality Assurance and Testing Department,6 Aug 2018,2.0,3.0,2.0,3.0,1.0,1.0,3.0,"Other than salary appraisal, nothing much on the better side.",Monopoly of Managers an HOD's. They don't treat engineers as equals.
Senior Manager Spare Parts,Gurgaon,,SCM & Logistics Department,3 Jan 2019,5.0,5.0,5.0,5.0,5.0,5.0,4.0,"Innovation ...Latest technology.   Good environment 
Knowledge sharing and management intrraction.",Less Career growth and opportunities with in the organization
Billing Executive,Ghaziabad,,SCM & Logistics Department,2 Dec 2019,5.0,5.0,5.0,5.0,5.0,5.0,5.0,I like company rule,Late night work without extra benefits
Retail Manager,Vijayawada,,,1 Jan 2020,5.0,4.0,4.0,3.0,1.0,5.0,3.0,Have good communication with my Boss nd co-workers.. Have a great time with my team,No job security
Sales Executive,Jaipur,,Retail & B2C Sales Department,2 Feb 2018,4.0,5.0,5.0,5.0,5.0,5.0,5.0,Staff managment is so rude and all members In staff not good,Problem for staff managment
Warehouse Incharge,Ghaziabad,,Warehouse Department,8 Aug 2019,4.0,3.0,4.0,3.0,4.0,4.0,5.0,Fantastic experience..,Nill
Sales Officer,Adajan Surat,,Na Department,0 Sep 2019,3.0,1.0,2.0,1.0,1.0,2.0,1.0,Very bed experience in Panasonic,Not good
,,,,5 May 2018,3.0,4.0,2.0,4.0,3.0,3.0,3.0,,
,,,,,,4.0,2.0,4.0,3.0,3.0,3.0,,
Jr. Officer-operations,Bengaluru,Full Time,,0 May 2018,5.0,5.0,5.0,2.0,3.0,4.0,1.0,"The company is open to innovative and readily adopts latest technology,high quality products compare to competitors and my colleagues from bro. Various company background and south Indian and north Indian culture and I work happily in collaboration but one thing off role are are very suffered",No compensation  for off role employees no growth for off roles the work  pressures is moderate . I do receives a operation from managers. And colleagues hence senior folks like me have to guided step by step
Sales Executive,Gurgauan,Full Time,Delhi  Department,2 Apr 2020,5.0,5.0,5.0,5.0,5.0,5.0,5.0,"Thanks for confirmation and review me
Team Leader is awesome and that are Trainer And Back Staff very supportable",None of these
Logistic Coordinator,Gurgaon,,SCM & Logistics Department,8 Mar 2019,4.0,5.0,5.0,5.0,5.0,4.0,3.0,More Learning,No monitor of work given to Employee by HR
Branch Service Manager,"Jaipur, Rajasthan",,Non Voice Department,9 Aug 2022,4.0,4.0,3.0,3.0,4.0,4.0,3.0,Employee friendly atmosphere,Less growth oppertunities
Computer Operator Data Entry Operator,Goa,,Service Department,9 Aug 2019,5.0,5.0,5.0,5.0,5.0,5.0,5.0,Products quality & best services,Not support branding
Teamleader,Rajahmundry,,Division Department,7 Mar 2019,5.0,5.0,5.0,5.0,5.0,5.0,3.0,The team is well organized and probably the best product team in Panasonic. Unfortunately we all have left or are about to,Worst work life balance..no management inclination to maintain work life balance. Every organization suffers from politics but here you will get to see a whole new level
Junior Sales Officer,,,,8 May 2020,3.0,3.0,2.0,2.0,2.0,2.0,2.0,"No job security, Lots of politices and Low salary if you are on third party pay role.",Third pay employees treated as chickens.
"Assistant Manager,Product Manager-LED/LCD/Plasma Business)- Marketing",Gurgaon,,Marketing Department,1 Dec 2018,3.0,1.0,3.0,2.0,2.0,3.0,2.0,,
Operations Officer,Gurugram,,,0 Nov 2019,1.0,1.0,3.0,2.0,2.0,3.0,2.0,,
Junior Sales Officer,Udaipur,,Retail & B2C Sales Department,9 Sep 2019,5.0,2.0,3.0,3.0,2.0,1.0,1.0,,
,,,,,,1.0,1.0,1.0,1.0,1.0,5.0,,
,,,,,,5.0,5.0,4.0,4.0,5.0,5.0,,
,,,,,,5.0,5.0,4.0,4.0,5.0,,,
Promoter,,Full Time,Retail & B2C Sales Department,0 May 2018,3.0,2.0,3.0,3.0,1.0,4.0,1.0,Excellent work culture and team members,Need little improvement in the compensation given to employees
Manager,Gurgaon,Full Time,,5 May 2019,5.0,2.0,3.0,3.0,1.0,4.0,1.0,Good,SUNIL KAUSHIK
Branch Commercial Head,Patna,,Accounting & Taxation Department,1 Oct 2019,4.0,5.0,4.0,4.0,4.0,5.0,5.0,Panasonic,great working experianc
Assembly Technician,Jhajjar,,Godgaw Department,2 Sep 2019,4.0,4.0,4.0,4.0,4.0,4.0,4.0,no,Career Growth
Sales Executive,Lucknow,,Retail & B2C Sales Department,9 Jul 2019,5.0,5.0,4.0,4.0,4.0,4.0,4.0,None,Learn how to improve My self
Sales Executive,Hyderabad,,Corporate Training Department,4 Apr 2019,5.0,5.0,5.0,5.0,5.0,5.0,5.0,I have joined this  company to earn more but I'm not getting incentives on time what ever has promised to me & salary also late for some times,All good
Sales Executive,Banjarahills,,Wp Department,4 Jan 2019,2.0,4.0,5.0,4.0,5.0,5.0,5.0,Working culture and Staff Motivation and Support.,Nothing to say for that
Area Sales Manager,Hyderabad,,BD / Pre Sales Department,8 Nov 2019,5.0,2.0,2.0,1.0,1.0,1.0,1.0,No cultures and not complete returns solid you can do completely buttering than can survive otherwise no life no future. 70% Hods are fake no working only buttering no results no financial growth only loss growth of loss.,Buttering and no future security's
Sales Team Leader,Ahmedabad,,Corporate Communication Department,4 Mar 2019,4.0,5.0,5.0,5.0,5.0,5.0,5.0,,
Deputy Manager Finance Accounts,Gurgaon,,Accounting & Taxation Department,1 Aug 2018,2.0,4.0,4.0,4.0,4.0,4.0,4.0,,
,,,,,,1.0,2.0,3.0,1.0,1.0,1.0,,
Branch Marketing Manager,Chennai,,Marketing Department,5 Oct 2021,5.0,3.0,5.0,5.0,5.0,5.0,5.0,"Positive Culture 
Opportunity to grow
Good structure and system",Work life balance
Assembly,Jhajhar,,,4 Mar 2019,4.0,3.0,5.0,4.0,5.0,5.0,2.0,Good job but not carrier growth,Personal growth  not a carrier growth for this company
Sr. Executive Manufacturing,Jhajjar,,Manufacturing Department,6 Nov 2018,5.0,5.0,5.0,4.0,5.0,5.0,5.0,"Love working with panasonic...
Looking for long working with such a reputed organisation...",No dislikes
Senior Sales Executive,Lucknow,,Retail & B2C Sales Department,9 Sep 2019,5.0,4.0,5.0,5.0,5.0,5.0,4.0,Yse I working Panasonic India Pvt.ltd.,Yse
Area Service Manager,Indore,,Operations Department,8 Jun 2019,5.0,4.0,5.0,2.0,4.0,4.0,4.0,learning. innivation,Yes Best company
6 Year,Indote,,Enterprise & B2B Sales Department,3 May 2019,5.0,5.0,5.0,5.0,5.0,5.0,5.0,Very good company,Good
Customer Service Manager,Hyderabad,,Retail Store Operations Department,3 Mar 2018,5.0,4.0,4.0,4.0,5.0,3.0,4.0,Policy is much flexier,Can't even think of one good aspect. I must say...it is a great global company but in India it is beautifully mismanaged by top level management team.
Branch Technical Support,,,Service  Department,1 Nov 2019,5.0,5.0,4.0,3.0,5.0,4.0,5.0,Already mentioned above,Nothing
Head - Mobility Service,Gurgram,,Operations Department,6 May 2022,1.0,5.0,4.0,3.0,5.0,4.0,5.0,Not trust worthy in june they hire team of professionals which they think is a team of fools and in 5 months u got a call that your project is over and you can find new job,
Relationship Manager,Chandighar,,Artists Department,1 Dec 2018,1.0,3.0,2.0,4.0,3.0,1.0,2.0,,
,,,,,,1.0,1.0,1.0,1.0,3.0,3.0,,
"Lasf (marketing ,sale's)",Varanasi,,,5 Jun 2019,5.0,5.0,5.0,4.0,5.0,5.0,5.0,Hi,Selry
Branch Marketing Manager,Gurgaon/Gurugram,,Marketing Department,9 Nov 2021,5.0,5.0,5.0,5.0,5.0,5.0,5.0,Great learning and innovation at the best,Nothing
Financial Planning Officer- IT,Gurgaon,,IT Department,5 Mar 2019,5.0,5.0,5.0,5.0,5.0,5.0,5.0,Excellent Experience,Overall Experience is good
Area Sales Manager,Delhi,,BD / Pre Sales Department,0 Dec 2018,4.0,2.0,4.0,3.0,2.0,3.0,2.0,"salary not good ,travel policy not good, family life hell",work environment not good
Sales Analyst,Gurgqon,,Sales Support & Operations Department,9 Feb 2019,1.0,1.0,1.0,2.0,1.0,2.0,1.0,"Work life balance and learning something new in the organisation, but there is no job security.","Joined to learning new things and balancing for life and job security, but there is no job security. Although Japanese managment is well. But flutter peoples do all it at their own end."
Senior Logistics Executive,New Delhi,,SCM & Logistics Department,2 May 2022,3.0,3.0,2.0,2.0,3.0,2.0,3.0,Nothing exciting,no culture
Branch Marketing Manager,Gurgaon,,Marketing Department,8 Nov 2020,5.0,4.0,5.0,5.0,5.0,5.0,5.0,Very good learning experience,Change in roles frequently
Deputy Manager Quality Assurance,Jhajjar,,Production & Manufacturing Department,8 May 2018,4.0,3.0,2.0,3.0,5.0,5.0,4.0,"If you've got the spark in you, you'll grow in Panasonic. There are N number of chances to move up on the ladder if you're willing to work hard here.","Salary structure is something they need to work on, there's no slab for salary. People are getting different salaries on the same level."
